reseña,calificación,tipo_lugar,fuente,nombre,fecha,grupo_de_viaje,mes
la experiencia en general estuvo bien y el hotel tiene varios puntos positivos que disfrutamos las piscinas son muy bonitas amplias y agradables para pasar el día uno de los aspectos que más nos gustó fue la comida el buffet tiene bastante variedad y constantemente están reponiendo la comida así que casi siempre se encuentra todo fresco había opciones diferentes tanto para desayuno como para almuerzo y cena incluyendo frutas ensaladas carnes pastas postres y comida típica además nos pareció positivo que hubiera varias estaciones y opciones para distintos gustos el restaurante japonés furama fue una de las mejores partes de la experiencia la comida estaba muy rica bien presentada y el ambiente era agradable sin embargo hubo varios detalles que nos dejaron un sinsabor el servicio al cliente es bastante inconsistente algunos meseros fueron muy amables atentos y serviciales pero otros prácticamente nos ignoraban en el american country por ejemplo tuvimos que esperar bastante para que alguien nos atendiera porque los meseros evitaban hacer contacto visual después de un buen rato fue que enviaron a otra persona a atendernos algo similar pasó en algunos bares también tuvimos problemas con la habitación el aire acondicionado no funcionaba y después de tres llamadas a mantenimiento nos ofrecieron cambiarnos de habitación cuando ya faltaba solo una noche para irnos el jacuzzi tampoco tenía agua caliente y el sauna de hombres estuvo fuera de servicio toda la estadía por lo que mi cuñado no pudo usarlo otro punto incómodo es el sistema de electricidad de la habitación donde hay que dejar la llave conectada para que funcione la corriente eso impide dejar cargando celulares tablets audífonos o mantener el aire acondicionado encendido mientras uno sale cada vez que regresábamos la habitación estaba extremadamente caliente y había que esperar bastante a que se enfriara además no hay enchufes en la terraza así que si alguien quiere trabajar ahí con la computadora debe asegurarse de cargarla antes la pantalla tampoco se puede conectar a netflix ni emparejar desde el celular el wifi es de lo peor hay que estar iniciando sesión una y otra vez y a cada rato se cae en las áreas comunes también notamos problemas de limpieza varias sillas alrededor de la piscina estaban sucias incluso con restos de comida y los baños comunes olían mal y no se veían limpios por último al salir hacia la playa todas las sillas estaban apiladas y cada huésped debía cargar y acomodar la suya por cuenta propia el servicio de toallas también fue bastante inconsistente según el personal solo permiten cambiarlas una vez al día porque se les acaban así que si uno usa la toalla en la playa durante la mañana y queda completamente mojada en la tarde ponen mala cara si se solicita una nueva en resumen el hotel tiene cosas muy buenas especialmente las instalaciones y la comida pero definitivamente hay aspectos de servicio limpieza y mantenimiento que deberían mejorar para que la experiencia realmente esté al nivel esperado,2,hotel,https://search.google.com/local/reviews?placeid=chijprzi_5qono8roeniq-shqio&q=*&authuser=0&hl=en&gl=us,hotel riu guanacaste,06/08/2026,amigos,agosto
tenía 4 años de no ir y debo decir que en infraestructura esta muy bonito sin embargoantes los meseros te tomaban la orden en la piscina y llevaban las bebidas ahí eso ya no sucede el mini bar lo llenan cada 2 días y no ponen bebidas para niños y bien que cobran la estancia de ellos el parque acuático cierra un día a la semana y tiene horario de apertura a las 10 am me parece que se paga mucho dinero para esas restricciones,3,hotel,https://search.google.com/local/reviews?placeid=chijprzi_5qono8roeniq-shqio&q=*&authuser=0&hl=en&gl=us,hotel riu guanacaste,06/07/2026,,julio
muy mal servicio en la telefonia he llamado 5 veces nadie contesta,2,hotel,https://search.google.com/local/reviews?placeid=chijprzi_5qono8roeniq-shqio&q=*&authuser=0&hl=en&gl=us,hotel riu guanacaste,06/06/2026,,junio
la remodelación quedó muy bien las instalaciones muy limpias la comida en su mayoria estaba bien a la hora de la salida solo dan la opción de un restaurante y muy poca comida ni siquiera tenian pizza papas o helados se siente como si ya por el hecho de salir ya no merece uno algo bueno deberian mejorar esa parte,4,hotel,https://search.google.com/local/reviews?placeid=chijprzi_5qono8roeniq-shqio&q=*&authuser=0&hl=en&gl=us,hotel riu guanacaste,06/05/2026,familia,mayo
nos encantó el show nocturno del viernes white party otro nivel ha mejorado mucho todo nada más que el restaurante asiático debería ser con reservacion no estar haciendo una fila enorme desde temprano,5,hotel,https://search.google.com/local/reviews?placeid=chijprzi_5qono8roeniq-shqio&q=*&authuser=0&hl=en&gl=us,hotel riu guanacaste,06/05/2026,,mayo
es un linda experiencia la pasa uno muy bien agunos de los que atienden al público en los bares principalmente tal vez por ser uno nacional no son amables son toscos y el servicio lo hacen de poca gana pero a los extranjeros los atienden muy bien,4,hotel,https://search.google.com/local/reviews?placeid=chijprzi_5qono8roeniq-shqio&q=*&authuser=0&hl=en&gl=us,hotel riu guanacaste,06/04/2026,familia,abril
si tienen chance de pagar un poquito más vaya al riu palace es un hotel también familiar menos gente mejor servicio cerveza en lata nacional room service y se puede pasar al riu guanacaste algo que debe mejorar riu guanacaste es en aumentar la cantidad de personal en los bares se nota que hay uno sirviendo el otro acomodando y la multitud esperando por esto las malas caras y el maltrato al personal tanto en riu guanacaste como el riu palace se puede usar el parque acuático,4,hotel,https://search.google.com/local/reviews?placeid=chijprzi_5qono8roeniq-shqio&q=*&authuser=0&hl=en&gl=us,hotel riu guanacaste,06/03/2026,amigos,marzo
me gustaria un hotel riu en puntarenas o jaco,4,hotel,https://search.google.com/local/reviews?placeid=chijprzi_5qono8roeniq-shqio&q=*&authuser=0&hl=en&gl=us,hotel riu guanacaste,06/03/2026,,marzo
el hotel el servicio la comida tienen un 10 de 10 pero tuvimos un par de inconvenientes primero el agua del lavatorio de la habitación cada vez que se usaba olía muy mal como que reciclan el agua de alguna manera y obviamente le advierten a uno que no la puede consumir pero el olor es lo más molesto adicional a eso para ser un hotel tan grande no tener cargadores eléctricos para vehículos deja mucho que desear ya que cada vez más se están usando este tipo de vehículos en el país y para los que viajamos desde muy lejos es muy incómodo andar buscando un cargador lejos del hotel,4,hotel,https://search.google.com/local/reviews?placeid=chijprzi_5qono8roeniq-shqio&q=*&authuser=0&hl=en&gl=us,hotel riu guanacaste,06/03/2026,familia,marzo
hotel hermoso los baristas tienen un excelente servicio al cliente habitaciones lindas aseadas el personal del restaurante de carnes se veían muy cansados exageradamente serios y se sentía que atendían por hacerlo podría mejorar en los shows el grupo musical tenía muy ma sonido se oía como guardada la música como en un hueco me hizo falta la famosa fiesta de espuma que hacen en algunos hoteles es divertido y entretiene bastante tiene más variedad en comida que otros hoteles sin embargo podrían variarla aún más una desventaja es que el internet se va constantemente por más que pedimosa clave ahí no teníamos señal en cualquier lado aún teniendo nuestro internet no entraba tan fácil el personal de limpieza y los qe entregaban bebidas son personas agradables y muy educadas los felicito quedé satisfecha,4,hotel,https://search.google.com/local/reviews?placeid=chijprzi_5qono8roeniq-shqio&q=*&authuser=0&hl=en&gl=us,hotel riu guanacaste,06/02/2026,familia,febrero
me gusta mucho siempre lo visito de 1 o 2 veces al año y para mi siempre he recibido buen servicio a mis hijos les encanta y es bastante familiar,5,hotel,https://search.google.com/local/reviews?placeid=chijprzi_5qono8roeniq-shqio&q=*&authuser=0&hl=en&gl=us,hotel riu guanacaste,06/02/2026,familia,febrero
excelente ahora con heladería,5,hotel,https://search.google.com/local/reviews?placeid=chijprzi_5qono8roeniq-shqio&q=*&authuser=0&hl=en&gl=us,hotel riu guanacaste,06/02/2026,familia,febrero
excelente atención y muy agradecidos con todos ustedes esperando ansioso volver al hotel,5,hotel,https://search.google.com/local/reviews?placeid=chijprzi_5qono8roeniq-shqio&q=*&authuser=0&hl=en&gl=us,hotel riu guanacaste,06/01/2026,familia,enero
la comida repetitivael día de salida no puede uno escoger el restaurante y la comida muy sencillahay que solicitar varias veces entre ir y llamar para que le den un pañoarmen el sofá cama le ayuden con la caja fuerte no rellenan botellas de champú o acondicionador estaban menos de un octavo cuando ingresamos,4,hotel,https://search.google.com/local/reviews?placeid=chijprzi_5qono8roeniq-shqio&q=*&authuser=0&hl=en&gl=us,hotel riu guanacaste,30/05/2026,familia,mayo
para mi ha sido la mejor experiencia de mi vida todo fue increíble claro que volveré a ir,5,hotel,https://search.google.com/local/reviews?placeid=chijprzi_5qono8roeniq-shqio&q=*&authuser=0&hl=en&gl=us,hotel riu guanacaste,30/05/2026,familia,mayo
instalaciones muy bonitas y limpias buen servicio variedad de comidas bebidas y postres muchas actividades de entretenimiento playa cerca y personal con buena mística de trabajo y servicio lo que si note que el personal que uno se topa en el pasillo no dice buenos días si uno no saluda y en su semblante da una percepción de no estar muy cómodo,5,hotel,https://search.google.com/local/reviews?placeid=chijprzi_5qono8roeniq-shqio&q=*&authuser=0&hl=en&gl=us,hotel riu guanacaste,29/05/2026,,mayo
en el check in dure 1 hora y en la salida el restaurante muy poca selecion y no habia helados ya que lo mandan aotro restaurante que no es liberia,3,hotel,https://search.google.com/local/reviews?placeid=chijprzi_5qono8roeniq-shqio&q=*&authuser=0&hl=en&gl=us,hotel riu guanacaste,28/05/2026,,mayo
hace unos años nos hospedamos en el hotel y nos robaron en la habitación todo el dinero el hotel no se hizo responsable de nada y dejaron de respondernos los emails la habitación estaba cerrada con llave como la dejamos y sucedió mientras fuimos a desayunar la ventana hacia el patio también estaba trabada por lo que no pudieron entrar por ahí un desastre,1,hotel,https://search.google.com/local/reviews?placeid=chijprzi_5qono8roeniq-shqio&q=*&authuser=0&hl=en&gl=us,hotel riu guanacaste,28/05/2026,,mayo
1000 recomendado el mejor hotel todo incluido,5,hotel,https://search.google.com/local/reviews?placeid=chijprzi_5qono8roeniq-shqio&q=*&authuser=0&hl=en&gl=us,hotel riu guanacaste,28/05/2026,,mayo
excelente opción para vivir unas vacaciones en familia solo tuvimos problemas al ingreso porque un fin de semana larga todos los visitantes tenemos que ingresar a las 3pm y se bloqueó de forma adversa para el trato fluido qué uno espera punto a mejorar,5,hotel,https://search.google.com/local/reviews?placeid=chijprzi_5qono8roeniq-shqio&q=*&authuser=0&hl=en&gl=us,hotel riu guanacaste,28/05/2026,,mayo
el hotel está completamente renovado las instalaciones son hermosas nuevas limpias el personal es muy atento y amable la comida es muy típica y deliciosa el gimnasio esta bien equipado aunque solo le faltan barras y discos lo único es que si te tocan las habitaciones que empiezan con 6 prepárate para caminar muchísimo para ir a la playa al foro o al restaurante liberia el más grande,5,hotel,https://search.google.com/local/reviews?placeid=chijprzi_5qono8roeniq-shqio&q=*&authuser=0&hl=en&gl=us,hotel riu guanacaste,28/05/2026,pareja,mayo
excelente lugar bastante variedad y muy amplio nunca se ve abarrotada el personal debería enfocarse en atender a todos bien no solo a los que traen propinas,5,hotel,https://search.google.com/local/reviews?placeid=chijprzi_5qono8roeniq-shqio&q=*&authuser=0&hl=en&gl=us,hotel riu guanacaste,28/05/2026,familia,mayo
estuvo todo muy bonito solo siento que debería haber mas variedad en carnes pero por el resto todo excelente,5,hotel,https://search.google.com/local/reviews?placeid=chijprzi_5qono8roeniq-shqio&q=*&authuser=0&hl=en&gl=us,hotel riu guanacaste,27/05/2026,,mayo
puntos a mejorar a nuestra llegada el personal de recepción nos atendió de mala forma el internet fue inestable durante la estadía tuvimos problemas con el checkin online y debimos volver a recepción la calidad de los cócteles y la atención variaban según el bar y el bartender en los restaurantes temáticos nos dijeron que no requerían reserva pero no encontramos espacio aspectos positivos la habitación y las áreas comunes siempre estuvieron limpias el personal de limpieza y del restaurante buffet liberia fue muy amable y atento,2,hotel,https://search.google.com/local/reviews?placeid=chijprzi_5qono8roeniq-shqio&q=*&authuser=0&hl=en&gl=us,hotel riu guanacaste,27/05/2026,familia,mayo
muy sastisfecho mi familia les encantó muy muy espacioso la comida muy buena no hay quejas me encantaría poder volver,5,hotel,https://search.google.com/local/reviews?placeid=chijprzi_5qono8roeniq-shqio&q=*&authuser=0&hl=en&gl=us,hotel riu guanacaste,26/05/2026,familia,mayo
segunda vez lindo les quedo el hotel renovado de guanacaste,5,hotel,https://search.google.com/local/reviews?placeid=chijprzi_5qono8roeniq-shqio&q=*&authuser=0&hl=en&gl=us,hotel riu guanacaste,26/05/2026,,mayo
exelente comida ubicación y servicio,5,restaurante,https://search.google.com/local/reviews?placeid=chijzzsue4d8oi8renpnkwef13i&q=*&authuser=0&hl=en&gl=us,la divina comida fusión peruana,18/05/2026,,mayo
fuimos a almorzar y nos trajeron platos diferentes a lo que pedimos y mucho más costosos y un restaurante peruano que no tenía pizco pensé que por lo menos nos cobrarían lo que pedimos pero no les importo pésimo servicio y el restaurante lleno de zancudos y caliente,1,restaurante,https://search.google.com/local/reviews?placeid=chijzzsue4d8oi8renpnkwef13i&q=*&authuser=0&hl=en&gl=us,la divina comida fusión peruana,18/05/2026,,mayo
la divina comida es definitivamente uno de nuestros lugares favoritos siempre disfrutamos muchísimo ir porque la comida es deliciosa y las porciones son súper generosas nuestros platos favoritos son la causa de mariscos el ceviche clásico con leche de tigre y el risotto paisano todos con muchísimo sabor y muy bien preparados la calidad de la comida y la consistencia hacen que siempre queramos volver muy recomendado para quienes disfrutan de buena comida,5,restaurante,https://search.google.com/local/reviews?placeid=chijzzsue4d8oi8renpnkwef13i&q=*&authuser=0&hl=en&gl=us,la divina comida fusión peruana,13/05/2026,,mayo
la comida muy mala para el precio cero calidad y nada extravagante el ambiente malo tambien no habia nadie se nota que esta mas en decadencia pero el servicio excelente la gente nos atendio muy bien,1,restaurante,https://search.google.com/local/reviews?placeid=chijzzsue4d8oi8renpnkwef13i&q=*&authuser=0&hl=en&gl=us,la divina comida fusión peruana,04/06/2026,,junio
excelente la comida y para que decir los postres creo que es el mejor suspiro limeño que he probado buena sentencian del personal,5,restaurante,https://search.google.com/local/reviews?placeid=chijzzsue4d8oi8renpnkwef13i&q=*&authuser=0&hl=en&gl=us,la divina comida fusión peruana,19/03/2026,,marzo
lugar y ambiente muy bonito en la zona de escazu comida fusion buena y sabrosa el sitio,5,restaurante,https://search.google.com/local/reviews?placeid=chijzzsue4d8oi8renpnkwef13i&q=*&authuser=0&hl=en&gl=us,la divina comida fusión peruana,25/02/2026,,febrero
buenísima comida y el servicio excelente fue nuestro primer día en costa rica y no pudo haber empezado mejor en este restaurante,5,restaurante,https://search.google.com/local/reviews?placeid=chijzzsue4d8oi8renpnkwef13i&q=*&authuser=0&hl=en&gl=us,la divina comida fusión peruana,02/04/2026,,abril
desde la comida hasta la atención super el menú es poco complicado pero con la ayuda del mesonero pides gastamos 95000 3 plato 1 entrada mas bebidas,4,restaurante,https://search.google.com/local/reviews?placeid=chijzzsue4d8oi8renpnkwef13i&q=*&authuser=0&hl=en&gl=us,la divina comida fusión peruana,02/03/2026,,marzo
primera y última vez la comida estuvo bien pero el precio no se justifica el servicio al cliente fue deficiente pedimos una entrada quedaron de confirmar si tenían los ingredientes y nunca nos respondieron no ofrecieron bebidas y en general el trato fue pobre mientras esperaba la comida vi en su facebook una promoción del 25 de descuento en todo el menú válida hasta el 31 de enero de 2026 al pedir la cuenta se lo mencioné al mesero y me indicaron que ya no aplicaba intentamos hablar con alguien más y nos dijeron que nadie podía ayudarnos con una actitud despectiva poco profesional y de mala gana lo que terminó de arruinar la experiencia,1,restaurante,https://search.google.com/local/reviews?placeid=chijzzsue4d8oi8renpnkwef13i&q=*&authuser=0&hl=en&gl=us,la divina comida fusión peruana,26/01/2026,,enero
todo fue excelente el lugar la atención y la comida fue exquisita los platillos ordenados fueron un asado peruano y risotto con lomo salteado las porciones eran muy generosas y todo en su punto,5,restaurante,https://search.google.com/local/reviews?placeid=chijzzsue4d8oi8renpnkwef13i&q=*&authuser=0&hl=en&gl=us,la divina comida fusión peruana,21/12/2025,,diciembre
el lugar es muy lindo fuimos a celebrar un cumpleaños 13 personas sin embargo esperamos 140min para que nos trajeran la comida pedimos entradas y platos fuertes y todo llegó al mismo tiempo algunos platos estaban muy ricos pero a otros les faltó sabor para la cantidad de tiempo que esperamos no volveríamos a ir llegamos a las 830 y a pesar de que éramos la única mesa que quedaba la comida nos llegó hasta las 1020pm cierran a las 11pm durante todo ese tiempo no se preocuparon para ver si queríamos algo más de tomar para cuando terminamos de comer obviamente el restaurante ya había cerrado mientras comíamos comenzaron a recoger y acomodar mesas lo cuál hace que uno se sienta apresurado para comer no nos dio tiempo de tomarnos un cafe tranquilos primero nos dijeron que ya habían apagado la máquina y aunque si nos ofrecieron postre ya era muy tarde,3,restaurante,https://search.google.com/local/reviews?placeid=chijzzsue4d8oi8renpnkwef13i&q=*&authuser=0&hl=en&gl=us,la divina comida fusión peruana,12/11/2025,,noviembre
pésima relación calidad precio la comida sabe súper básica y nada peruana porciones pequeñas y sin sabor rescató la atención de los meseros que es realmente buena de las peores formas de gastar el dinero nosotros nos sentimos estafados,1,restaurante,https://search.google.com/local/reviews?placeid=chijzzsue4d8oi8renpnkwef13i&q=*&authuser=0&hl=en&gl=us,la divina comida fusión peruana,12/07/2025,,julio
la comida no era de buena calidad el ceviche umami estaba amargo nos lo comimos y nos cayó mal decía que tenía leche de tigre pero nunca la sentimos no se puede comparar con la comida peruana real comida mala calidad mal sabor y mala relación calidad precio en cuanto servicio de personal es lo único que rescatamos de nuestra mala experiencia meseros muy amables y serviciales íbamos con altas expectativas y salimos desepcionados con hambre y enfermos,1,restaurante,https://search.google.com/local/reviews?placeid=chijzzsue4d8oi8renpnkwef13i&q=*&authuser=0&hl=en&gl=us,la divina comida fusión peruana,12/07/2025,,julio
ubicado en una de esas zonas modernas y vidriadas que podrían ser puerto madero en buenos aires o cualquier barrio cosmopolita de una gran ciudad si uno se despertara allí sin contexto podría creer que está en cualquier centro urbano de primer nivel y la propuesta del lugar acompaña esa sensación un restaurante de cocina fusión peruana que busca ser moderno elegante y con un toque de exclusividad pero con los pies firmes en las raíces de la gastronomía del perú desde la mesa se entiende rápido que acá hay alguien pensando en la experiencia completa el bajo plato de cerámica en tonos fríos el individuales de fibra trenzada que aportan textura y calidez el vaso verde tallado la servilleta celeste con la marca bordada y como guiño marino el aro con forma de pez que la abraza nada grita lujo pero todo susurra criterio y coherencia no es decoración al azar es narrativa visual la cocina está a cargo del chef marco antonio ganoza y su presencia en sala es parte central de la experiencia se lo ve de buen humor cercano atento moviéndose entre mesas con la seguridad de quien domina su producto pero sin el ego sobreactuado que a veces intoxica la alta cocina se nota que el show existe pero también se nota algo más importante autenticidad su carta es de esas que se leen y se entiende que hubo horas de prueba error y corrección detrás de cada plato fusión bien entendida respeto por la base peruana y licencias inteligentes para jugar con sabores y técnicas hasta ahí todo dentro del manual de un buen restaurante contemporáneo lo verdaderamente interesante apareció cuando uno de los comensales decidió salirse del guion y pidió algo tan simple como peligroso para cualquier cocina seria un atún en punto blue apenas marcado sin más artificios ese pedido en muchos lugares se resuelve con una negativa amable o con una versión adaptada que encaje en el concepto de la carta marco antonio en cambio aceptó el desafío sin dramatismo y ahí es donde se ve el oficio un atún servido casi desnudo no tiene dónde esconderse si la materia prima no es impecable se nota al primer bocado si el punto de cocción se pasa medio segundo el resultado se vuelve corriente si la temperatura o el sellado están mal resueltos el plato se cae el chef no solo cumplió con lo pedido lo superó el atún llegó a la mesa en su justa expresión color intenso exterior apenas sellado corazón crudo y sedoso sabor limpio sin rastros metálicos ni excesos de frío un plato minimalista que por simple se vuelve examen técnico y la cocina lo aprobó con nota alta al nivel de cualquier casa especializada en plazas como lima buenos aires o ciudad de méxico la sala acompaña ese estándar el equipo de servicio funciona como una extensión del criterio del dueño y del chef profesionales atentos siempre con una sonrisa sincera sin caer en la sobreactuación ni en la confianza excesiva cada movimiento parece ensayado pero sin rigidez como si todos supieran que el objetivo es uno solo que el comensal se vaya mejor de lo que llegó en definitiva la divina comida es de esos lugares donde todo encaja el contexto el espacio la propuesta gastronómica la materia prima y el factor humano se siente la mano de alguien que eligió a su equipo con el mismo cuidado con el que selecciona un buen trozo de atún sin concesiones una experiencia altamente recomendable para quien busque en costa rica algo más que comer bien buscar coherencia identidad y oficio en cada detalle desde un simple plato de atún vuelta y vuelta hasta la sonrisa con la que te despiden en la puerta gracias marco antonio por la propuesta y por recordarnos que la verdadera fusión no está solo en el plato sino en la manera en que se combinan técnica producto y humanidad,5,restaurante,https://search.google.com/local/reviews?placeid=chijzzsue4d8oi8renpnkwef13i&q=*&authuser=0&hl=en&gl=us,la divina comida fusión peruana,12/07/2025,,julio
lo que pedí de comer no tenía nada de sabor la mesera fue muy amable pero la calidad de la comida no vale la pena y menos a esos precios cambiaron el chef y se nota por qué el sabor es pésimo,2,restaurante,https://search.google.com/local/reviews?placeid=chijzzsue4d8oi8renpnkwef13i&q=*&authuser=0&hl=en&gl=us,la divina comida fusión peruana,20/11/2025,,noviembre
en la vida comeria yo aqui,1,restaurante,https://search.google.com/local/reviews?placeid=chijzzsue4d8oi8renpnkwef13i&q=*&authuser=0&hl=en&gl=us,la divina comida fusión peruana,11/11/2025,,noviembre
clasica comida peruana muy buen sabor en un ambiente agradable,5,restaurante,https://search.google.com/local/reviews?placeid=chijzzsue4d8oi8renpnkwef13i&q=*&authuser=0&hl=en&gl=us,la divina comida fusión peruana,31/10/2025,,octubre
pedimos un ceviche carpaccio de remolacha y chaufa de pollo con el ceviche me intoxiqué y pasé toda la noche más que fatal el carpaccio eran rodajas gruesas no delgado como debe ser un carpaccio el chaufa 1kg de arroz sin ningún sabor ni sal y mínima cantidad de pollo los 3 anfitriones al lado de la mesa quitando toda privacidad en su vaciladera y el salonero al pedirle agua para tomar y no un trago cambió por completo su manera de atendernos a veces uno solo quiere agua no volveremos,1,restaurante,https://search.google.com/local/reviews?placeid=chijzzsue4d8oi8renpnkwef13i&q=*&authuser=0&hl=en&gl=us,la divina comida fusión peruana,26/10/2025,,octubre
la comida no cumplió con las expectativas pedí un tacu tacu y un ceviche ambos sin sabor y con mala textura el ceviche se sentía viscoso y la leche de tigre casi no se percibía lo mejor fueron las cortesías de yuca con una salsa roja muy buena en general mala relación calidadprecio y poca autenticidad peruana a pesar de eso el ambiente y la atención fueron excelentes el lugar tiene una temática muy original el host y los meseros fueron súper atentos y amables una gran experiencia en servicio pero la comida necesita mejorar,4,restaurante,https://search.google.com/local/reviews?placeid=chijzzsue4d8oi8renpnkwef13i&q=*&authuser=0&hl=en&gl=us,la divina comida fusión peruana,19/10/2025,,octubre
