reseña,calificación,tipo_lugar,fuente,nombre,fecha,grupo_de_viaje,mes
el parque es muy bonito lamentablemente cuando fuimos se nublo y no pudimos ver el crater pero tiene lindos miradores y senderos para recorrer,5,parque nacional,https://search.google.com/local/reviews?placeid=chijtwemkyb1oi8rpv7euxdlhlw&q=*&authuser=0&hl=en&gl=us,poás volcano,04/01/2026,,enero
es un lugar sin duda increíble lamentablemente me toco mal clima y la neblina no me dejo ver el cráter pero hay un museo donde te explica la historia tienen un lugar donde venden varios recuerditos espero volver para poder apreciar el cráter,5,parque nacional,https://search.google.com/local/reviews?placeid=chijtwemkyb1oi8rpv7euxdlhlw&q=*&authuser=0&hl=en&gl=us,poás volcano,28/03/2026,,marzo
un privilegio que tenemos los costarricenses de tener un volcán activo que se puede visitar durante casi todo el año y que siempre se puede admirar su imponente cráter uno de los más grandes del mundo,5,parque nacional,https://search.google.com/local/reviews?placeid=chijtwemkyb1oi8rpv7euxdlhlw&q=*&authuser=0&hl=en&gl=us,poás volcano,23/03/2026,,marzo
es recomendable ir temprano además de ver el cráter hay que ver la laguna que está a 10 minutos,4,parque nacional,https://search.google.com/local/reviews?placeid=chijtwemkyb1oi8rpv7euxdlhlw&q=*&authuser=0&hl=en&gl=us,poás volcano,16/03/2026,,marzo
simplemente impresionante la vista del cráter y de la laguna senderos perfectamente marcados y excelente trato por parte del personal,5,parque nacional,https://search.google.com/local/reviews?placeid=chijtwemkyb1oi8rpv7euxdlhlw&q=*&authuser=0&hl=en&gl=us,poás volcano,03/09/2026,,septiembre
excelente área natural si vas a costa rica agenda este lugar pasa a la cafeteria museo y realiza la caminata completa,5,parque nacional,https://search.google.com/local/reviews?placeid=chijtwemkyb1oi8rpv7euxdlhlw&q=*&authuser=0&hl=en&gl=us,poás volcano,03/03/2026,,marzo
fuimos en auto hasta el parque compramos las entradas por la página es de fácil acceso al parque nos tocó un día lluvioso así que a pesar de las ganas no pudimos ver el cráter sin embargo la experiencia fue buena se siente el olor a azufre y hay vestigios de actividad volcánica al recorrer los senderos no nos acompañó el clima pero seguro la próxima tendremos suerte,5,parque nacional,https://search.google.com/local/reviews?placeid=chijtwemkyb1oi8rpv7euxdlhlw&q=*&authuser=0&hl=en&gl=us,poás volcano,17/02/2026,,febrero
la experiencia muy linda pero no pude ver el cráter estaba con mucha neblina es importante fijarse que tal las nubes hacia las montañas por que generalmente hay mucha neblina y asi no se ve nada,4,parque nacional,https://search.google.com/local/reviews?placeid=chijtwemkyb1oi8rpv7euxdlhlw&q=*&authuser=0&hl=en&gl=us,poás volcano,02/12/2026,,diciembre
maravilloso,5,parque nacional,https://search.google.com/local/reviews?placeid=chijtwemkyb1oi8rpv7euxdlhlw&q=*&authuser=0&hl=en&gl=us,poás volcano,02/09/2026,,septiembre
ten en cuenta que el 90 por ciento de las veces no se ve absolutamente nada por el vapor y la niebla vas a pagar por no ver nada caminar y hasta mojarte y no verás nada de nada y ellos no responden teléfono ni te dicen nada para que pagues por gusto y te des el viaje busca antes de ir,1,parque nacional,https://search.google.com/local/reviews?placeid=chijtwemkyb1oi8rpv7euxdlhlw&q=*&authuser=0&hl=en&gl=us,poás volcano,02/08/2026,,agosto
el volcán poás es y será siempre un lugar atractivo turísticamente vale enteramente la pena y es necesario tomarse una foto en este lugar tan emblemático si es turista,5,parque nacional,https://search.google.com/local/reviews?placeid=chijtwemkyb1oi8rpv7euxdlhlw&q=*&authuser=0&hl=en&gl=us,poás volcano,28/01/2026,,enero
cuando se ve y no hay tormenta es excelente lo que no me parece bien es que si está malas las condiciones tengas la posibilidad de ir otro día sin pagar no tienen esa atención con el turista aclarando que abajo del volcán el día estaba impecable uno no lo sabe lo que ve hasta que sube,3,parque nacional,https://search.google.com/local/reviews?placeid=chijtwemkyb1oi8rpv7euxdlhlw&q=*&authuser=0&hl=en&gl=us,poás volcano,25/01/2026,,enero
el cráter más ancho del mundo increíble,5,parque nacional,https://search.google.com/local/reviews?placeid=chijtwemkyb1oi8rpv7euxdlhlw&q=*&authuser=0&hl=en&gl=us,poás volcano,16/01/2026,,enero
me encantó,5,parque nacional,https://search.google.com/local/reviews?placeid=chijtwemkyb1oi8rpv7euxdlhlw&q=*&authuser=0&hl=en&gl=us,poás volcano,01/05/2026,,mayo
es toda una suerte lograr ver el cráter del volcán pero si lo logras valdrá la pena hay un sitio web para ver en vivo el estado del volcán y así calcular si las nubes te dejarán verlo,5,parque nacional,https://search.google.com/local/reviews?placeid=chijtwemkyb1oi8rpv7euxdlhlw&q=*&authuser=0&hl=en&gl=us,poás volcano,01/03/2026,,marzo
lo recomiendo la entrada cuesta 15 más iva se debe de comprar en línea se camina para el cráter unos 15 min o menos tiene senderos de dificultad media para ir a ver su segundo cráter convertido en laguna el clima es agradable tiene una sala de exposicion a cerca del volcán y una tienda de souvenirs puede llegar todo tipo de automóvil se cancela 3000 o 6000 colones no recuerdo muy bien de parqueo,5,parque nacional,https://search.google.com/local/reviews?placeid=chijtwemkyb1oi8rpv7euxdlhlw&q=*&authuser=0&hl=en&gl=us,poás volcano,16/12/2025,,diciembre
excelente parque nacional,5,parque nacional,https://search.google.com/local/reviews?placeid=chijtwemkyb1oi8rpv7euxdlhlw&q=*&authuser=0&hl=en&gl=us,poás volcano,12/11/2025,,noviembre
no recomiendo este lugar la comida no estaba rica y solo permiten una cuenta por mesa,2,restaurante,https://search.google.com/local/reviews?placeid=chijaxausm4moi8raw-vlggmbbc&q=*&authuser=0&hl=en&gl=us,red frog coffee roasters,06/06/2026,,junio
ricos platillos,5,restaurante,https://search.google.com/local/reviews?placeid=chijaxausm4moi8raw-vlggmbbc&q=*&authuser=0&hl=en&gl=us,red frog coffee roasters,14/05/2026,,mayo
muy buena plática con el dueño aunque la comida me cayó mal,3,restaurante,https://search.google.com/local/reviews?placeid=chijaxausm4moi8raw-vlggmbbc&q=*&authuser=0&hl=en&gl=us,red frog coffee roasters,26/04/2026,,abril
tuve una mala experiencia en su local el ambiente era bueno tranquilo y relajante mencionar que la actitud del gerente fue de respeto y buena atención hacia mi persona sin embargo la atención que obtuvimos por parte de mesero fue mala grosera apresurada se sintio ese constante coma rapido mi pareja tuvo una situación con esta persona a la hora de retirar los platos ya que el mio fue el primero en retirar luego los de nuestros amigos ella tuvo que recalcar yo como despacio para que dejara la necedad posteriormente agarro el bolso de mi pareja sin su consentimiento y lo puso en otro lado ya cuando todos habiamos finalizado de comer de la manera mas grotesca se mete en la conversación con la cuenta a cobrarme cuando ni siquiera habia pasado 2 minutos de finalizar la cena a uno de mis amigos le hizo arrebatado el plato de la boca sin preguntar la actitud del mesero siempre fue apresurado puedo llegar a entender que ya querian cerrar primero que nada era a las 630 pm que llegamos a su local despues siento que hubiese sido mejor que sean honestos y digan no podemos atenderlos porque ya es tarde y estamos proximos a cerrar antes de dar ese pesimo servicio,1,restaurante,https://search.google.com/local/reviews?placeid=chijaxausm4moi8raw-vlggmbbc&q=*&authuser=0&hl=en&gl=us,red frog coffee roasters,04/08/2026,,agosto
comida exquisita muy amables el cafe con hielo estaba buenísimo,5,restaurante,https://search.google.com/local/reviews?placeid=chijaxausm4moi8raw-vlggmbbc&q=*&authuser=0&hl=en&gl=us,red frog coffee roasters,04/04/2026,,abril
un día pedimos unos burritos para desayunar y estaba bien aunque carísimos al día siguiente volvimos porque por la zona no había mucho más abierto temprano y pedimos desayuno americano y para vomitar las tortitas mojadas y malísimas el bacon podía ser lo que fuera menos bacon y el precio desorbitado complicado comer más días aquí,2,restaurante,https://search.google.com/local/reviews?placeid=chijaxausm4moi8raw-vlggmbbc&q=*&authuser=0&hl=en&gl=us,red frog coffee roasters,25/03/2026,,marzo
finalmente una steakhouse que hace las cosas bien el new york steak estaba cocido correctamente en el término solicitado con buen sabor y buena textura servicio sólido y consistente buen detalle el pan con mantequilla los acompañamientos completos incluido balsámico una ensalada fresca que realmente vale la pena comer y un puré de papa bien hecho como acompañamiento en general una experiencia muy buena y coherente carne bien preparada buenos acompañamientos y servicio correcto una verdadera steakhouse bien ejecutada,5,restaurante,https://search.google.com/local/reviews?placeid=chijktnyss_9oi8r85xoj5csyyu&q=*&authuser=0&hl=en&gl=us,el novillo alegre sabana,15/05/2026,,mayo
excelente para celebrar cumpleaños,5,restaurante,https://search.google.com/local/reviews?placeid=chijktnyss_9oi8r85xoj5csyyu&q=*&authuser=0&hl=en&gl=us,el novillo alegre sabana,05/08/2026,,agosto
si gustas o eres una persona amantes de comer buenas este es el lugar para ti dos personas un gasto no menor a 50 mil,5,restaurante,https://search.google.com/local/reviews?placeid=chijktnyss_9oi8r85xoj5csyyu&q=*&authuser=0&hl=en&gl=us,el novillo alegre sabana,20/04/2026,,abril
todo bien aunque el servicio es algo lento y olvidaron un platillo,4,restaurante,https://search.google.com/local/reviews?placeid=chijktnyss_9oi8r85xoj5csyyu&q=*&authuser=0&hl=en&gl=us,el novillo alegre sabana,14/04/2026,,abril
100 recomendado la comida es muy rica,5,restaurante,https://search.google.com/local/reviews?placeid=chijktnyss_9oi8r85xoj5csyyu&q=*&authuser=0&hl=en&gl=us,el novillo alegre sabana,14/04/2026,,abril
excelente cortes de carne a la parrilla la calidad el servicio y el ambiente son de primera,5,restaurante,https://search.google.com/local/reviews?placeid=chijktnyss_9oi8r85xoj5csyyu&q=*&authuser=0&hl=en&gl=us,el novillo alegre sabana,04/11/2026,,noviembre
la carne es excelente nada que envidiarle a restaurantes del doble de caros cerca de la zona,4,restaurante,https://search.google.com/local/reviews?placeid=chijktnyss_9oi8r85xoj5csyyu&q=*&authuser=0&hl=en&gl=us,el novillo alegre sabana,25/03/2026,,marzo
muy buena comida y servicio lo recomiendo,5,restaurante,https://search.google.com/local/reviews?placeid=chijktnyss_9oi8r85xoj5csyyu&q=*&authuser=0&hl=en&gl=us,el novillo alegre sabana,02/06/2026,,junio
materia prima de primera calidad javier se ha portado genial muy recomendable,5,restaurante,https://search.google.com/local/reviews?placeid=chijktnyss_9oi8r85xoj5csyyu&q=*&authuser=0&hl=en&gl=us,el novillo alegre sabana,01/04/2026,,abril
de los mejores cortes de carne que he probado,5,restaurante,https://search.google.com/local/reviews?placeid=chijktnyss_9oi8r85xoj5csyyu&q=*&authuser=0&hl=en&gl=us,el novillo alegre sabana,01/04/2026,,abril
lugar para disfrutar con amigos y familia,5,restaurante,https://search.google.com/local/reviews?placeid=chijktnyss_9oi8r85xoj5csyyu&q=*&authuser=0&hl=en&gl=us,el novillo alegre sabana,21/12/2025,,diciembre
mala atención los meseros son clásicas,1,restaurante,https://search.google.com/local/reviews?placeid=chijktnyss_9oi8r85xoj5csyyu&q=*&authuser=0&hl=en&gl=us,el novillo alegre sabana,18/12/2025,,diciembre
cumplió con las expectativas que llevaba del lugar me encantó el servicio son muy atentos y amables lo recomiendo si quieren un ambiente acogedor y tranquilo felicidades,5,restaurante,https://search.google.com/local/reviews?placeid=chijktnyss_9oi8r85xoj5csyyu&q=*&authuser=0&hl=en&gl=us,el novillo alegre sabana,12/08/2025,,agosto
me encanta,5,restaurante,https://search.google.com/local/reviews?placeid=chijktnyss_9oi8r85xoj5csyyu&q=*&authuser=0&hl=en&gl=us,el novillo alegre sabana,22/11/2025,,noviembre
el restaurante es precioso pedí el corte recomendado en término medio llegó 34 y la verdad para ese precio esperaba una mejor carne si regreso sería para café pero no para carnes,2,restaurante,https://search.google.com/local/reviews?placeid=chijktnyss_9oi8r85xoj5csyyu&q=*&authuser=0&hl=en&gl=us,el novillo alegre sabana,22/11/2025,,noviembre
el bife no estaba en el término solicitado no vale la pena se volvió muy comercial,3,restaurante,https://search.google.com/local/reviews?placeid=chijktnyss_9oi8r85xoj5csyyu&q=*&authuser=0&hl=en&gl=us,el novillo alegre sabana,11/10/2025,,octubre
las carnes de este restaurante son de muy buena calidad con el termino tal cuál los solicito los saloneros muy capacitados y serviciales el lugar a veces de hace muy pequeño en horas pico por lo que es mejor reservar a esas horas los postres deliciosos recomiendo este restaurante argentino,5,restaurante,https://search.google.com/local/reviews?placeid=chijktnyss_9oi8r85xoj5csyyu&q=*&authuser=0&hl=en&gl=us,el novillo alegre sabana,23/10/2025,,octubre
ignoraron que era alérgica al tomate me atendió un señor que aunque me recibió la orden de ensalada y le dije que era alérgica al tomate cuando ordene el plato fuerte que era un lomito mar y tierra no me dijo que era con salsa de tomate me atendió de mala manera wao fue a una semana y todavía tengo alergia y la atención de ese señor en general no fue buena,2,restaurante,https://search.google.com/local/reviews?placeid=chijktnyss_9oi8r85xoj5csyyu&q=*&authuser=0&hl=en&gl=us,el novillo alegre sabana,21/10/2025,,octubre
súper delicioso y los meseros son bien amables,5,restaurante,https://search.google.com/local/reviews?placeid=chijktnyss_9oi8r85xoj5csyyu&q=*&authuser=0&hl=en&gl=us,el novillo alegre sabana,21/10/2025,,octubre
la comida está muy rica el servicio es bueno pero podrían ser más amables los meseros,5,restaurante,https://search.google.com/local/reviews?placeid=chijktnyss_9oi8r85xoj5csyyu&q=*&authuser=0&hl=en&gl=us,el novillo alegre sabana,14/10/2025,,octubre
el novillo alegre es una cadena de restaurantes especializadas en carnes de temática argentina he comido en todos sin embargo el de la sábana se caracteriza por tener mejor calidad en la preparación de la comida y siento que la calidad de las carnes es superior los platillos están realizados con ingredientes frescos tienen buena presentación y porciones adecuadas tienen excelente variedad de vinos y otros licores finos para acompañar las carnes que es en lo que se especializan el ambiente es cálido y familiar lo mejor que tiene el restaurante es el personal les doy un 100 en atención al cliente trabajan con dedicación y alegría y se encargan de hacernos sentir como en casa todo bajo la cultura tica del pura vida el lugar se llena mucho recomiendo realizar una reservación si van a comer con su familia o compañeros de trabajo es un lugar que todavía es grato visitar y si uno es nacional le aplican descuentos considerables con ciertas tarjetas bancarias,5,restaurante,https://search.google.com/local/reviews?placeid=chijktnyss_9oi8r85xoj5csyyu&q=*&authuser=0&hl=en&gl=us,el novillo alegre sabana,10/08/2025,,agosto
el restaurante me lo recomendaron mis amistades al entrar al local el ambiente es bastante agradable el personal te atiende de inmediato y son muy amables vi la carta y solicité un chorizo argentino de entrada y un bife como plato fuerte el corte lo pedí termino medio y fue entregado tal cual lo solicité eso fue excelente de bebida me dieron una de que no se encontraba en el menú y la verdad me gustó consulten por los sides algunos no están indicados en el menú y están muy buenos,5,restaurante,https://search.google.com/local/reviews?placeid=chijktnyss_9oi8r85xoj5csyyu&q=*&authuser=0&hl=en&gl=us,el novillo alegre sabana,10/02/2025,,febrero
la zona de la entrada es muy bonita en la parte de atrás por el patio en mi opinión necesita una remodelacion los alimentos siempre están super deliciosos y ni hablar de los postres solo deberían tener más personal para no tener que estar llamándolos constantemente y también constantemente olvidan lo que uno pidió en general este novillo sabana es mi novillo favorito,4,restaurante,https://search.google.com/local/reviews?placeid=chijktnyss_9oi8r85xoj5csyyu&q=*&authuser=0&hl=en&gl=us,el novillo alegre sabana,22/09/2025,,septiembre
tenia bastante tiempo sin ir al novillo alegre y ayer fuí acompañado porque teniamos ganas de comer buena carne definitivamente ir al novillo es garantía de satisfacción y vamos a ir punto por punto las instalaciones nos parecen demasiado limpias se nota mucho esmero en eso en cuanto al servicio nos atendió javier nos dió muchas sugerencias que demuestra que conoce muy bien su trabajo fue muy educado y gentil el se ganó las 5 estrellas sin ninguna duda en cuando a las bebidas bastante grandes con muchas frutas y muy buen sabor sin exceso de hielo que la echara a perder el plato que pedí es algo inusual porque pedí puré de papá con papas fritas para acompañar la carne no es lo mas correcto pero tienen esa flexibilidad de elegir los acompañamientos para complacer al cliente en cuanto a la carne pedimos un bife de chorizo cada uno en término medio y el otro 34s y venían en un término perfecto ambos cortes algo que es bastante difícil de conseguir en este tipo de restaurantes pero en eso el novillo alegre no falla nunca tampoco en cuanto al postre no recuerdo el nombre pero estuvo delicioso perfecto para compartir y sin llegar a empalagar,5,restaurante,https://search.google.com/local/reviews?placeid=chijktnyss_9oi8r85xoj5csyyu&q=*&authuser=0&hl=en&gl=us,el novillo alegre sabana,17/09/2025,,septiembre
demasiado caro por una comida que no estan buena,2,restaurante,https://search.google.com/local/reviews?placeid=chijktnyss_9oi8r85xoj5csyyu&q=*&authuser=0&hl=en&gl=us,el novillo alegre sabana,14/09/2025,,septiembre
últimamente el precio elevado es ridículo para lo que recibes inflan los precios para luego aplicarte un 50 de descuento con el bac,4,restaurante,https://search.google.com/local/reviews?placeid=chijktnyss_9oi8r85xoj5csyyu&q=*&authuser=0&hl=en&gl=us,el novillo alegre sabana,13/09/2025,,septiembre
fui por una promoción con el bac donde había 50 de descuento con las tarjetas mastercard la comida deliciosa pedimos un tomahawk un chorizo argentino y una ensalada la comida estuvo deliciosa y el personal sumamente atento mi madre tiene la enfermedad celíaca por lo cual el gluten es un problema y los mismos meseros pudieron recomendarle opciones gluten free y modificación de la ensala para que llegara sin crutones definitivamente volveremos pronto,5,restaurante,https://search.google.com/local/reviews?placeid=chijktnyss_9oi8r85xoj5csyyu&q=*&authuser=0&hl=en&gl=us,el novillo alegre sabana,09/09/2025,,septiembre
un lugar demasiado hermoso ademas de su atención que es un 100 y su comida que es exquisita super recomendado no pierdan la oportunidad de comer super y con precios increíbles,5,restaurante,https://search.google.com/local/reviews?placeid=chijktnyss_9oi8r85xoj5csyyu&q=*&authuser=0&hl=en&gl=us,el novillo alegre sabana,26/08/2025,,agosto
excelente lugar,5,restaurante,https://search.google.com/local/reviews?placeid=chijktnyss_9oi8r85xoj5csyyu&q=*&authuser=0&hl=en&gl=us,el novillo alegre sabana,18/08/2025,,agosto
siempre pido la entraña que es mi corte favorito y bueno delicioso la atención muy buena por parte de los meseros y el restaurante es muy lindo lo recomiendo mucho tienen parqueo pero es muy pequeño la gente normalmente debe dejar el carro en la calle o se debe buscar un parqueo cercano,5,restaurante,https://search.google.com/local/reviews?placeid=chijktnyss_9oi8r85xoj5csyyu&q=*&authuser=0&hl=en&gl=us,el novillo alegre sabana,30/07/2025,,julio
demasiado caro para lo que sirven,3,restaurante,https://search.google.com/local/reviews?placeid=chijktnyss_9oi8r85xoj5csyyu&q=*&authuser=0&hl=en&gl=us,el novillo alegre sabana,28/06/2025,,junio
como todo restaurante argentino son principalmente carnes pero encontrarás pasta pollo y pescado también la comida está deliciosa y el trato que te dan es genial,5,restaurante,https://search.google.com/local/reviews?placeid=chijktnyss_9oi8r85xoj5csyyu&q=*&authuser=0&hl=en&gl=us,el novillo alegre sabana,17/06/2025,,junio
buenos cortes de carne de res,5,restaurante,https://search.google.com/local/reviews?placeid=chijktnyss_9oi8r85xoj5csyyu&q=*&authuser=0&hl=en&gl=us,el novillo alegre sabana,06/03/2025,,marzo
excelente atención,5,restaurante,https://search.google.com/local/reviews?placeid=chijktnyss_9oi8r85xoj5csyyu&q=*&authuser=0&hl=en&gl=us,el novillo alegre sabana,30/05/2025,,mayo
el mejor restaurante de parrilla argentina nos atendieron de manera excepcional y toda la comida que pedimos estuvo deliciosa,5,restaurante,https://search.google.com/local/reviews?placeid=chijktnyss_9oi8r85xoj5csyyu&q=*&authuser=0&hl=en&gl=us,el novillo alegre sabana,26/05/2025,,mayo
excelentes los cortes de carne lomito y el bife,5,restaurante,https://search.google.com/local/reviews?placeid=chijktnyss_9oi8r85xoj5csyyu&q=*&authuser=0&hl=en&gl=us,el novillo alegre sabana,13/05/2025,,mayo
amo este lugar el mejor pulpo q las brasas que he comido en mi vida simplemente regreso por ese ya no pido ninguna otra cosa jajaja,5,restaurante,https://search.google.com/local/reviews?placeid=chijktnyss_9oi8r85xoj5csyyu&q=*&authuser=0&hl=en&gl=us,el novillo alegre sabana,05/06/2025,,junio
a pesar del restaurante haber estado lleno la atención y la calidad fueron excelentes,5,restaurante,https://search.google.com/local/reviews?placeid=chijktnyss_9oi8r85xoj5csyyu&q=*&authuser=0&hl=en&gl=us,el novillo alegre sabana,05/04/2025,,abril
su decoración natural crea un ambiente refrescante y agradable para conversar yo reunión de negocios la presentación de los platos es siempre un gusto a la vista y la atención al cliente es uno de sus puntos más altos,5,restaurante,https://search.google.com/local/reviews?placeid=chijktnyss_9oi8r85xoj5csyyu&q=*&authuser=0&hl=en&gl=us,el novillo alegre sabana,05/02/2025,,febrero
excelente servicio y ambiente,5,restaurante,https://search.google.com/local/reviews?placeid=chijktnyss_9oi8r85xoj5csyyu&q=*&authuser=0&hl=en&gl=us,el novillo alegre sabana,30/04/2025,,abril
muuuy buen ceviche patacones frescos buena limonada,5,restaurante,https://search.google.com/local/reviews?placeid=chijuxfeqqipno8rsrfpeswgctm&q=*&authuser=0&hl=en&gl=us,numu taproom and bistro by chef nicolas devenelle,10/11/2024,,noviembre
excelente servicio el lugar es muy tranquilo y muy lindo tienen que probar su cerveza artesanal que ha ganado muchos premios,5,restaurante,https://search.google.com/local/reviews?placeid=chijuxfeqqipno8rsrfpeswgctm&q=*&authuser=0&hl=en&gl=us,numu taproom and bistro by chef nicolas devenelle,10/02/2024,,febrero
muy bonito lugar bien montado realmente acogedor atendido por gente muy cordial,5,restaurante,https://search.google.com/local/reviews?placeid=chijuxfeqqipno8rsrfpeswgctm&q=*&authuser=0&hl=en&gl=us,numu taproom and bistro by chef nicolas devenelle,07/03/2024,,marzo
excelente lugar y el servicio de otro nivel,5,restaurante,https://search.google.com/local/reviews?placeid=chijuxfeqqipno8rsrfpeswgctm&q=*&authuser=0&hl=en&gl=us,numu taproom and bistro by chef nicolas devenelle,15/04/2024,,abril
nos trataron de forma despectiva como tiquillos cuando todos los saloneros son ticos de costa rica y no nos siguieron atendiendo por ser ticos y teniendo con que pagar aparte pedimos 2 bebidas más y nunca nos llegaron y el menú nunca nos llegó they treated us contemptuously like tiquillos when all the waiters are ticos from costa rica and he didnt continue serving us because we were costa ricans and had enough to pay we also ordered 2 more drinks and they never arrived and the menu never arrived,1,restaurante,https://search.google.com/local/reviews?placeid=chijuxfeqqipno8rsrfpeswgctm&q=*&authuser=0&hl=en&gl=us,numu taproom and bistro by chef nicolas devenelle,04/02/2024,,febrero
muy agradable sitio,5,restaurante,https://search.google.com/local/reviews?placeid=chijuxfeqqipno8rsrfpeswgctm&q=*&authuser=0&hl=en&gl=us,numu taproom and bistro by chef nicolas devenelle,20/03/2024,,marzo
el lugar super hermoso la atención excelente la comida de lo mejor realmente uno de los mejores lugares para ir y degustar platillos no solo presentados de manera elegante sino deliciosos yo soy alérgica a los mariscos y realmente se nota la calidad del lugar porque ni el olor a mariscos me afectó,5,restaurante,https://search.google.com/local/reviews?placeid=chijuxfeqqipno8rsrfpeswgctm&q=*&authuser=0&hl=en&gl=us,numu taproom and bistro by chef nicolas devenelle,26/02/2024,,febrero
exquisita comida me encantó el servicio de lo mejor y super rápido platillos variados y muy buen ambiente,5,restaurante,https://search.google.com/local/reviews?placeid=chijuxfeqqipno8rsrfpeswgctm&q=*&authuser=0&hl=en&gl=us,numu taproom and bistro by chef nicolas devenelle,23/02/2024,,febrero
una experiencia culinaria única excelente servicio y temática original en cada platillo los licores de la casa son increíbles y sin duda la cereza del pastel fue y será el mejor postre con temática típica costarricense que he probado en la vida,5,restaurante,https://search.google.com/local/reviews?placeid=chij-f9v3mhjoi8rhq6hvhhjs1k&q=*&authuser=0&hl=en&gl=us,restaurante silvestre,06/07/2026,,julio
heiner hizo de nuestra noche aún más especial gracias el sabor de todo exquisito,5,restaurante,https://search.google.com/local/reviews?placeid=chij-f9v3mhjoi8rhq6hvhhjs1k&q=*&authuser=0&hl=en&gl=us,restaurante silvestre,06/06/2026,,junio
