reseña,calificación,tipo_lugar,fuente,nombre,fecha,grupo_de_viaje,mes
fue una pésima experiencia llegamos solo por una noche porque íbamos de paso nada más y a la hora de realizar el chek out nos hicieron el cobro de una toalla que ni siquiera pusieron en nuestra habitación simplemente fue inaudito pagar por algo que ellos ni siquiera nos dieron pero bueno en fin ellos igual te lo van a cobrar porque según las políticas del hotel la culpa siempre es del cliente y no de su personal que tal vez no revisó bien así que como recomendación mejor cuenten sus toallas y revisen su habitación apenas llegan porque sino les van a cobrar demás por cualquier incidente y no te van a brindar solución muy mal experiencia y muy mal servicio al cliente,1,hotel,https://search.google.com/local/reviews?placeid=chijotlytwcmoi8rjnmmgrtvqd4&q=*&authuser=0&hl=en&gl=us,baldi hot springs hotel resort & spa,23/05/2026,,mayo
todo muy bonito realmente me quedo sin palabras con tan semejante lugar,5,hotel,https://search.google.com/local/reviews?placeid=chijotlytwcmoi8rjnmmgrtvqd4&q=*&authuser=0&hl=en&gl=us,baldi hot springs hotel resort & spa,17/05/2026,,mayo
una experiencia relajante e imperdible en costa rica si visitas la zona del arenal baldí hot springs es una parada obligatoria lo que más me fascinó de este lugar es la gran variedad de piscinas termales que ofrece cada una tiene su propia temperatura y como regla general entre más cerca estés del volcán más caliente se siente el agua esto te permite explorar y encontrar el punto exacto de calor que más te guste en nuestro caso decidimos pasar la mayor parte del tiempo en la tercera piscina y fue una excelente elección tiene un ambiente increíble porque ahí mismo se encuentran los toboganes un restaurante y un wet bar bar dentro de la piscina lo que hace que la experiencia sea súper cómoda y divertida sin tener que salir del agua el horario me pareció perfecto para disfrutarlo por la tarde nosotros llegamos a las 500 pm y el lugar cierra hasta las 1000 pm esas 5 horas son el tiempo ideal para sumergirse relajarse por completo y no sentir el paso del tiempo además de las piscinas el sauna me gustó muchísimo está muy bien logrado y complementa perfecto el circuito de relajación para cerrar la noche con broche de oro al salir de las piscinas nos relajamos comiendo una buena pizza acompañada de una cerveza bien fría sin duda considero que son de las mejores aguas termales de costa rica totalmente recomendado para ir a relajarse y pasar un rato inolvidable,5,hotel,https://search.google.com/local/reviews?placeid=chijotlytwcmoi8rjnmmgrtvqd4&q=*&authuser=0&hl=en&gl=us,baldi hot springs hotel resort & spa,16/05/2026,familia,mayo
buena experiencia nos habían recomendado en gran parte del viaje este lugar por lo que decidimos pasar la tarde de nuestra llegada a la fortuna en el area de termas cuentan con una amplia variedad de piscinas con agua de diferentes temperaturas algunas con cascadas otras con bares en el interior de la piscina y otras con toboganes el espacio está muy bien cuidado la vegetación es abundante y hay facil acceso a duchas baños y camarines todo muy limpio el trato de todos quienes nos atendieron fue muy amable la única nota baja fue la alimentación se ofrece tipo buffet pero la verdad la variedad y la calidad deja bastante que desear habriamos estado dispuestos a pagar un poco más incluso de saber como sería es un lugar bastante concurrido por lo que quizás no es lo óptimo para relajarse totalmente pero de todas formas lo recomiendo,4,hotel,https://search.google.com/local/reviews?placeid=chijotlytwcmoi8rjnmmgrtvqd4&q=*&authuser=0&hl=en&gl=us,baldi hot springs hotel resort & spa,16/05/2026,pareja,mayo
un gran lugar para hospedarse un pasasar un rato agradable cuenta con varias albercas con distintas temperaturas de mas caliente a mas fría limpias baños limpios andadores y toboganes,5,hotel,https://search.google.com/local/reviews?placeid=chijotlytwcmoi8rjnmmgrtvqd4&q=*&authuser=0&hl=en&gl=us,baldi hot springs hotel resort & spa,15/05/2026,familia,mayo
es un lugar maravilloso encantador y multifuncional e inclusivo,5,hotel,https://search.google.com/local/reviews?placeid=chijotlytwcmoi8rjnmmgrtvqd4&q=*&authuser=0&hl=en&gl=us,baldi hot springs hotel resort & spa,05/05/2026,,mayo
para pasarla bien con amigos en familia en pareja etc el day pass en todo un éxito disfrutas de las termales todo el día hasta las 9pm el day pass incluye 1 o 2 tiempos de alimentación dependiendo del que pagues y el lugar es super bonito,5,hotel,https://search.google.com/local/reviews?placeid=chijotlytwcmoi8rjnmmgrtvqd4&q=*&authuser=0&hl=en&gl=us,baldi hot springs hotel resort & spa,05/03/2026,amigos,marzo
pésima experiencia los trabajadores son totalmente hostiles con los huéspedes y no hay enfoque en la experiencia del cliente que paga 450 la noche el internet del cuarto no sirve y la única solución es ir a trabajar al lobby donde los de recepción lo ven a uno y le interrumpencuestionan como si no fuera huésped de los 4 días que estuvimos hospedados en 2 días el elevador no sirvió y en ningún momento se disculparon o buscaron al menos explicar la situación precios absurdamente caros para ser tratados de esta pésima manera,1,hotel,https://search.google.com/local/reviews?placeid=chijotlytwcmoi8rjnmmgrtvqd4&q=*&authuser=0&hl=en&gl=us,baldi hot springs hotel resort & spa,27/04/2026,amigos,abril
aguas termales super hermoso,5,hotel,https://search.google.com/local/reviews?placeid=chijotlytwcmoi8rjnmmgrtvqd4&q=*&authuser=0&hl=en&gl=us,baldi hot springs hotel resort & spa,27/04/2026,,abril
servicio excelente e instalaciones realmente confortables super recomendado,5,hotel,https://search.google.com/local/reviews?placeid=chijotlytwcmoi8rjnmmgrtvqd4&q=*&authuser=0&hl=en&gl=us,baldi hot springs hotel resort & spa,23/04/2026,,abril
fuimos por un tour y nos sorprendió gratamente las instalaciones son increíbles y las piscinas tienen diferentes temperaturas por lo que te puedes ir adaptando repetiría sin dudarlo,5,hotel,https://search.google.com/local/reviews?placeid=chijotlytwcmoi8rjnmmgrtvqd4&q=*&authuser=0&hl=en&gl=us,baldi hot springs hotel resort & spa,23/04/2026,pareja,abril
todo todo todo bello vayan punto,5,hotel,https://search.google.com/local/reviews?placeid=chijotlytwcmoi8rjnmmgrtvqd4&q=*&authuser=0&hl=en&gl=us,baldi hot springs hotel resort & spa,14/04/2026,,abril
el día sábado el bar premium mal y pésimo servicio al cliente y aparte los cócteles más caros que en el otro bar lentos para atender y solo hablar entre los dos bartenders,3,hotel,https://search.google.com/local/reviews?placeid=chijotlytwcmoi8rjnmmgrtvqd4&q=*&authuser=0&hl=en&gl=us,baldi hot springs hotel resort & spa,04/12/2026,amigos,diciembre
es un lugar muy bonito las piscinas son amplias así que no estás tan cerca de otras personas la comida estuvo bien no deliciosa pero bien quise almorzar y cenar pero solamente había espacio para el almuerzo por lo que recomiendo reservar con anterioridad hay precio especial para costarricenses los toboganes tienen un horario diferente al de las piscinas no ví rótulos pero si me dí cuenta que cierran muchísimo antes que el resto del establecimiento los cócteles están bien también nada especial para los 12 de valor que tienen no hay área de fumado supongo que por la ley pero entonces mandan a la gente a fumar a la par del hotel en la vía pública deberían poner un cenicero para que no dejen las colillas altamente contaminante en el suelo es la primera vez que visito el lugar y tengo la sensación de que había un mal olor qué no es de las termales porque eran olores a aguas residuales en lugares muy específicos principalmente en las piscinas de 20c casualmente las que tienen más gente no sé a qué se debe pero con la cantidad de gente que utiliza las instalaciones quiero creer que no era olor de las aguas residuales de baldi cómo sugerencia al lugar deberían sembrar plantas nativas o especies frutales para atraer aves al lugar es muy bonito pero el paisajismo es de puras plantas ornamentales que no atraen aves,4,hotel,https://search.google.com/local/reviews?placeid=chijotlytwcmoi8rjnmmgrtvqd4&q=*&authuser=0&hl=en&gl=us,baldi hot springs hotel resort & spa,04/07/2026,pareja,julio
si quieres que los ñiños se diviertan es especial si pueden no pidan la opción de bufet es mediocre,3,hotel,https://search.google.com/local/reviews?placeid=chijotlytwcmoi8rjnmmgrtvqd4&q=*&authuser=0&hl=en&gl=us,baldi hot springs hotel resort & spa,31/03/2026,familia,marzo
no existe en todo costa rica unas termales mas hermosas que baldi no hay comparación con ninguna otra simplemente lo mejor,5,hotel,https://search.google.com/local/reviews?placeid=chijotlytwcmoi8rjnmmgrtvqd4&q=*&authuser=0&hl=en&gl=us,baldi hot springs hotel resort & spa,28/03/2026,familia,marzo
la comida a bajado en calidad le falta sazón los cócteles no están muy buenos pero sigue siendo mi lugar preferido porque el pase del día lo considero razonable,4,hotel,https://search.google.com/local/reviews?placeid=chijotlytwcmoi8rjnmmgrtvqd4&q=*&authuser=0&hl=en&gl=us,baldi hot springs hotel resort & spa,23/03/2026,amigos,marzo
hay q revisar las trallas bien porq si la mucama se le olvida poner una te las van a cobrar así q es mejor revisar todo muy bien por q si no van a parar un mal rato por lo demás todo muy lindo el hotel,2,hotel,https://search.google.com/local/reviews?placeid=chijotlytwcmoi8rjnmmgrtvqd4&q=*&authuser=0&hl=en&gl=us,baldi hot springs hotel resort & spa,21/03/2026,,marzo
lugar muy lindo y muy espacioso,5,hotel,https://search.google.com/local/reviews?placeid=chijotlytwcmoi8rjnmmgrtvqd4&q=*&authuser=0&hl=en&gl=us,baldi hot springs hotel resort & spa,18/03/2026,,marzo
pase del día los baños mojados y sucios siempre precio de snacks y comida elevado lo bueno lugar amplio con muchas piscinas termales,4,hotel,https://search.google.com/local/reviews?placeid=chijotlytwcmoi8rjnmmgrtvqd4&q=*&authuser=0&hl=en&gl=us,baldi hot springs hotel resort & spa,16/03/2026,familia,marzo
estuvimos hospedados 3 noches en el hotel en una habitación junior suite desde el día 11 hasta el sábado 14 de marzo de 2026 he ido en 4 ocasiones en los últimos años el hotel como desde la primera vez que me hospedé no invierten nada cada vez más dejado el desayuno cutrisimo y los empleados del bufet con muy pocas ganas de trabajar pendientes constantemente de si le dejan propina los baños de hombre de al lado del restaurante un pestazo en lo urinarios masculinos los tres días que fui a desayunar las piscinas y toboganes dejadísimos y los toboganes super peligrosos que no me abrí la cabeza de milagro los bares de las piscinas sport bar super cutre casi vacíos y no tiene cerveza imperial y encima cerveza mala a 8 dólares la limpieza en la habitación la limpiadora fue de 3 días 1 y por qué se lo dijimos dejamos la bolsa de basura en la puerta y no la recogía nadie eso si el sobre de la limpiadora para las propinas ahí preparado y ya el colmo cuando nos vamos nos dice la chica que estaba en el check out que tenemos que pagar una cápsula de café 4 dólares le digo pero si en todos los hoteles el café es gratis y no pone nada en el listado de precios de lo que valen las cápsulas y me saca la chica de recepción un folio de no sé dónde y me dice que las 4 primeras son gratis y que a partir de ahí a 4 dólares es para reírse mi pregunta fue pero son 4 cápsulas por día o por hospedaje no supo responder bueno pague 3000 colones y me marche bastante decepcionado,1,hotel,https://search.google.com/local/reviews?placeid=chijotlytwcmoi8rjnmmgrtvqd4&q=*&authuser=0&hl=en&gl=us,baldi hot springs hotel resort & spa,15/03/2026,familia,marzo
me salió un bicho en la comida y la ensalada estaba mala cuando la reporté solo me dijeron a bueno gracias,4,hotel,https://search.google.com/local/reviews?placeid=chijotlytwcmoi8rjnmmgrtvqd4&q=*&authuser=0&hl=en&gl=us,baldi hot springs hotel resort & spa,14/03/2026,pareja,marzo
lugar para el relax toboganes muy divertidos barra en algunas albercas lugar limpio casilleros cambiadores todo limpio restaurante,5,hotel,https://search.google.com/local/reviews?placeid=chijotlytwcmoi8rjnmmgrtvqd4&q=*&authuser=0&hl=en&gl=us,baldi hot springs hotel resort & spa,14/03/2026,amigos,marzo
excelente lugar recomendado las aguas termales,5,hotel,https://search.google.com/local/reviews?placeid=chijotlytwcmoi8rjnmmgrtvqd4&q=*&authuser=0&hl=en&gl=us,baldi hot springs hotel resort & spa,03/12/2026,,diciembre
fuimos alrededor de las 500 pm y fue un excelente horario para disfrutar el lugar con tranquilidad desde la recepción el personal explica todo de forma muy clara y detallada lo cual se agradece mucho recomiendo sacar la entrada simple sin cena ya que es más que suficiente para una buena experiencia el alquiler del locker cuesta usd 7 y entra perfectamente una mochila grande o dos pequeñas también te dan toallas con un depósito de usd 10 que se devuelve una vez que las entregás al salir una estadía de unas 3 horas como máximo es ideal más tiempo puede resultar excesivo se pueden comprar drinks en el bar húmedo están regulares en cuanto a las termas recomiendo especialmente la que incluye sauna sin dudas la mejor del complejo además al fondo del predio están las termas llamadas premium que también valen mucho la pena y son más tranquilas un lugar muy bien organizado ideal para relajarse después de un día activo en la fortuna,5,hotel,https://search.google.com/local/reviews?placeid=chijotlytwcmoi8rjnmmgrtvqd4&q=*&authuser=0&hl=en&gl=us,baldi hot springs hotel resort & spa,03/03/2026,amigos,marzo
un lugar muy lindo ambiente familiar todas las piscinas de agua termales caliente y algunas de agua fría dentro de las calientes los toboganes muy divertidos y en total un lindo lugar para vicitar,5,hotel,https://search.google.com/local/reviews?placeid=chijotlytwcmoi8rjnmmgrtvqd4&q=*&authuser=0&hl=en&gl=us,baldi hot springs hotel resort & spa,03/02/2026,amigos,febrero
visite el lugar y notamos algo que no nos gustó y es que el agua de las piscinas termales esta mucho más fría a todas las veces anteriores que e vistado el lugar estuve hace 10 meses y estaba bien la temperatura como siempre pero hace 2 días que estuvimos ahí no tuvimos una experiencia agradable por ese mismo motivo el lugar siempre a sido nuestro favorito respecto a otras aguas termales de la zona pero desconozco el motivo de la temperatura más fría de las aguas,4,hotel,https://search.google.com/local/reviews?placeid=chijotlytwcmoi8rjnmmgrtvqd4&q=*&authuser=0&hl=en&gl=us,baldi hot springs hotel resort & spa,27/02/2026,pareja,febrero
el lugar es hermoso tienes muchas piscinas se pasa muy bien vale cada dolar que pagas no me gustó la comida del buffet comida simple sin sabor como hecha de paquete,4,hotel,https://search.google.com/local/reviews?placeid=chijotlytwcmoi8rjnmmgrtvqd4&q=*&authuser=0&hl=en&gl=us,baldi hot springs hotel resort & spa,23/02/2026,familia,febrero
me gusto mucho este lugarel trato de los empleados es exelentelas aguas termales estan buenisimastodo limpiola vegetación extraordinariasatisfecho con mi visita 100,5,hotel,https://search.google.com/local/reviews?placeid=chijotlytwcmoi8rjnmmgrtvqd4&q=*&authuser=0&hl=en&gl=us,baldi hot springs hotel resort & spa,23/02/2026,,febrero
hermoso lugar vale la pena sin embargo no recomiendo la opción de buffet en el restaurant piramide 24usd caro mala calidad de la comida y pocas opciones,4,hotel,https://search.google.com/local/reviews?placeid=chijotlytwcmoi8rjnmmgrtvqd4&q=*&authuser=0&hl=en&gl=us,baldi hot springs hotel resort & spa,23/02/2026,,febrero
las mejores aguas termales que he visitado en mi vida la ambientación excelente muy bien señalizado todo increible,5,hotel,https://search.google.com/local/reviews?placeid=chijotlytwcmoi8rjnmmgrtvqd4&q=*&authuser=0&hl=en&gl=us,baldi hot springs hotel resort & spa,20/02/2026,amigos,febrero
lindo lugar la comida es regular,4,hotel,https://search.google.com/local/reviews?placeid=chijotlytwcmoi8rjnmmgrtvqd4&q=*&authuser=0&hl=en&gl=us,baldi hot springs hotel resort & spa,17/02/2026,,febrero
es un destino increíblehace años no iba y esta vez la atención fue increíble los lugares y piscinas son maravillosas un lugar obligatorio de conocer la comida está bien el parqueo es dentro de las instalaciones en años anteriores al visitante nacional no tenía buen trato ahora es distinto,5,hotel,https://search.google.com/local/reviews?placeid=chijotlytwcmoi8rjnmmgrtvqd4&q=*&authuser=0&hl=en&gl=us,baldi hot springs hotel resort & spa,02/07/2026,,julio
es familiar,3,hotel,https://search.google.com/local/reviews?placeid=chijotlytwcmoi8rjnmmgrtvqd4&q=*&authuser=0&hl=en&gl=us,baldi hot springs hotel resort & spa,02/03/2026,familia,marzo
ayer estuve en baldi y la experiencia fue excelente mi familia y yo la pasamos muy bien todo el personal es súper amable y atento la cena tipo bufet fue deliciosa y muy variada las piscinas estaban súper limpias y los baños en excelentes condiciones sin duda un lugar totalmente recomendado,5,hotel,https://search.google.com/local/reviews?placeid=chijotlytwcmoi8rjnmmgrtvqd4&q=*&authuser=0&hl=en&gl=us,baldi hot springs hotel resort & spa,02/02/2026,familia,febrero
las piscinas de aguas termales son geniales,5,hotel,https://search.google.com/local/reviews?placeid=chijotlytwcmoi8rjnmmgrtvqd4&q=*&authuser=0&hl=en&gl=us,baldi hot springs hotel resort & spa,30/01/2026,pareja,enero
increíble lugar excelente opción para relajarte después de un largo día en la fortuna sus aguas termales están en otro nivel muy recomendable,5,hotel,https://search.google.com/local/reviews?placeid=chijotlytwcmoi8rjnmmgrtvqd4&q=*&authuser=0&hl=en&gl=us,baldi hot springs hotel resort & spa,21/01/2026,,enero
el lugar por sí solo es hermoso las habitaciones y la comida están muy bien me parece que su personal está completamente desenfocado del servicio resolver las necesidades del cliente y de hacerlo sentir confortable posiblemente por la disputa legal que tienen parece que han han forzado el hecho de seguir operando a toda costa sin embargo no han tomado en cuenta la satisfacción de los clientes por ejemplo el que no tengan patente para venta de bebidas alcohólicas lo cual no te lo advierten al momento de la reservación te llevas la sorpresa en el check in tienen muchos bares fuera de funcionamiento y los q están solo venden bebidas sin licor la gran cantidad de personal de seguridad desde el ingreso y la desconfianza con que tratan a las personas realmente es muy desagradable y te hace sentir que no estás en un lugar seguro y que por eso tienen tanta seguridad por lo que en cualquier momento puede pasar algo no puede ser que en pleno 2026 te pidan dejar la tarjeta física si quieres tener cuenta abierta o que para un solicitar un paño tengas que dejar 5 mil colones en efectivo cuando ahora nadie anda efectivo y no dan ninguna otra solución realmente deberían replantear algunas de las políticas en virtud de brindarle al cliente una excelente experiencia de servicio todo esto deja mucho que desear,3,hotel,https://search.google.com/local/reviews?placeid=chijotlytwcmoi8rjnmmgrtvqd4&q=*&authuser=0&hl=en&gl=us,baldi hot springs hotel resort & spa,19/01/2026,pareja,enero
un excelente lugar para sentirse en el cielo,5,hotel,https://search.google.com/local/reviews?placeid=chijotlytwcmoi8rjnmmgrtvqd4&q=*&authuser=0&hl=en&gl=us,baldi hot springs hotel resort & spa,19/01/2026,amigos,enero
todo me a parecido increible bryan es genial y el gato de lo mejor,5,hotel,https://search.google.com/local/reviews?placeid=chijeyr6cipvoy8rpttpehhvvu4&q=*&authuser=0&hl=en&gl=us,barceló tambor,06/07/2026,familia,julio
lugar super limpio y la atención es muy buena,5,hotel,https://search.google.com/local/reviews?placeid=chijeyr6cipvoy8rpttpehhvvu4&q=*&authuser=0&hl=en&gl=us,barceló tambor,06/07/2026,,julio
es un lugar muy tranquilo para pasar en familia,5,hotel,https://search.google.com/local/reviews?placeid=chijeyr6cipvoy8rpttpehhvvu4&q=*&authuser=0&hl=en&gl=us,barceló tambor,06/07/2026,,julio
recibimiento con buena atención y claridad de indicaciones desde el inicio,5,hotel,https://search.google.com/local/reviews?placeid=chijeyr6cipvoy8rpttpehhvvu4&q=*&authuser=0&hl=en&gl=us,barceló tambor,06/07/2026,,julio
excelente animación las actividades la comida buena la atención las habitaciones muy bien la verdad contento,5,hotel,https://search.google.com/local/reviews?placeid=chijeyr6cipvoy8rpttpehhvvu4&q=*&authuser=0&hl=en&gl=us,barceló tambor,06/06/2026,amigos,junio
las actividades muy bien y el hotel es muy bueno las comidas y bebidas muy bien,5,hotel,https://search.google.com/local/reviews?placeid=chijeyr6cipvoy8rpttpehhvvu4&q=*&authuser=0&hl=en&gl=us,barceló tambor,06/06/2026,,junio
super buenop excelente atención,5,hotel,https://search.google.com/local/reviews?placeid=chijeyr6cipvoy8rpttpehhvvu4&q=*&authuser=0&hl=en&gl=us,barceló tambor,06/06/2026,,junio
excelente atención cm siempre buena comida,4,hotel,https://search.google.com/local/reviews?placeid=chijeyr6cipvoy8rpttpehhvvu4&q=*&authuser=0&hl=en&gl=us,barceló tambor,06/06/2026,amigos,junio
super encantado muy buena la atención super recomendado,5,hotel,https://search.google.com/local/reviews?placeid=chijeyr6cipvoy8rpttpehhvvu4&q=*&authuser=0&hl=en&gl=us,barceló tambor,06/06/2026,,junio
me gustó mucho solo que si ver un poco más las habitaciones que esta dañado el baño,5,hotel,https://search.google.com/local/reviews?placeid=chijeyr6cipvoy8rpttpehhvvu4&q=*&authuser=0&hl=en&gl=us,barceló tambor,06/06/2026,,junio
buena experiencia,5,hotel,https://search.google.com/local/reviews?placeid=chijeyr6cipvoy8rpttpehhvvu4&q=*&authuser=0&hl=en&gl=us,barceló tambor,06/06/2026,,junio
solo calidad,5,hotel,https://search.google.com/local/reviews?placeid=chijeyr6cipvoy8rpttpehhvvu4&q=*&authuser=0&hl=en&gl=us,barceló tambor,06/06/2026,,junio
excelente la comida la habitación te invita a descansar,5,hotel,https://search.google.com/local/reviews?placeid=chijeyr6cipvoy8rpttpehhvvu4&q=*&authuser=0&hl=en&gl=us,barceló tambor,06/06/2026,,junio
es un gran lugar para pasar en familia se disfruta mucho,5,hotel,https://search.google.com/local/reviews?placeid=chijeyr6cipvoy8rpttpehhvvu4&q=*&authuser=0&hl=en&gl=us,barceló tambor,06/06/2026,,junio
muy bien servicio exelente comida y las personas que laboran en el hotel son muy amables,5,hotel,https://search.google.com/local/reviews?placeid=chijeyr6cipvoy8rpttpehhvvu4&q=*&authuser=0&hl=en&gl=us,barceló tambor,06/06/2026,,junio
todo excelente el trato el staff de animación muy bonito,5,hotel,https://search.google.com/local/reviews?placeid=chijeyr6cipvoy8rpttpehhvvu4&q=*&authuser=0&hl=en&gl=us,barceló tambor,06/06/2026,,junio
muy lindos los show y las animaciones y sobre todo la atención,5,hotel,https://search.google.com/local/reviews?placeid=chijeyr6cipvoy8rpttpehhvvu4&q=*&authuser=0&hl=en&gl=us,barceló tambor,06/06/2026,,junio
realmente nos ha gustado mucho la experiencia rl personal super amable han superado las expectativas,5,hotel,https://search.google.com/local/reviews?placeid=chijeyr6cipvoy8rpttpehhvvu4&q=*&authuser=0&hl=en&gl=us,barceló tambor,06/06/2026,,junio
buena atención al cliente son atentos a lo que decimos tratan de siempre darnos lo mejor,5,hotel,https://search.google.com/local/reviews?placeid=chijeyr6cipvoy8rpttpehhvvu4&q=*&authuser=0&hl=en&gl=us,barceló tambor,06/06/2026,,junio
excelente para relajarse y súper buena atención al cliente 1010,5,hotel,https://search.google.com/local/reviews?placeid=chijeyr6cipvoy8rpttpehhvvu4&q=*&authuser=0&hl=en&gl=us,barceló tambor,06/06/2026,amigos,junio
muy buena atención,5,hotel,https://search.google.com/local/reviews?placeid=chijeyr6cipvoy8rpttpehhvvu4&q=*&authuser=0&hl=en&gl=us,barceló tambor,06/06/2026,amigos,junio
muy buen servicio,5,hotel,https://search.google.com/local/reviews?placeid=chijeyr6cipvoy8rpttpehhvvu4&q=*&authuser=0&hl=en&gl=us,barceló tambor,06/06/2026,,junio
excelente estadía confort y servicios con actividades entretenidas como el acuaerobicos también la caminata y minigolf,5,hotel,https://search.google.com/local/reviews?placeid=chijeyr6cipvoy8rpttpehhvvu4&q=*&authuser=0&hl=en&gl=us,barceló tambor,06/06/2026,,junio
muchas actividades y dinámicas bonitas,5,hotel,https://search.google.com/local/reviews?placeid=chijeyr6cipvoy8rpttpehhvvu4&q=*&authuser=0&hl=en&gl=us,barceló tambor,06/06/2026,,junio
excelente el show muy familiar,5,hotel,https://search.google.com/local/reviews?placeid=chijeyr6cipvoy8rpttpehhvvu4&q=*&authuser=0&hl=en&gl=us,barceló tambor,06/06/2026,pareja,junio
hotel tranquilo para pasar en familia,3,hotel,https://search.google.com/local/reviews?placeid=chijeyr6cipvoy8rpttpehhvvu4&q=*&authuser=0&hl=en&gl=us,barceló tambor,06/06/2026,,junio
excelente comida y el mejor chou,5,hotel,https://search.google.com/local/reviews?placeid=chijeyr6cipvoy8rpttpehhvvu4&q=*&authuser=0&hl=en&gl=us,barceló tambor,06/06/2026,,junio
excelente atención los show muy artistas y variados la comida muy buena,5,hotel,https://search.google.com/local/reviews?placeid=chijeyr6cipvoy8rpttpehhvvu4&q=*&authuser=0&hl=en&gl=us,barceló tambor,06/06/2026,,junio
nos encantó mucho todo muy bien,5,hotel,https://search.google.com/local/reviews?placeid=chijeyr6cipvoy8rpttpehhvvu4&q=*&authuser=0&hl=en&gl=us,barceló tambor,06/06/2026,,junio
todo muy bonito,5,hotel,https://search.google.com/local/reviews?placeid=chijeyr6cipvoy8rpttpehhvvu4&q=*&authuser=0&hl=en&gl=us,barceló tambor,06/06/2026,,junio
excelente experiencia super recomendado noches increíbles y exóticas increíble staff,5,hotel,https://search.google.com/local/reviews?placeid=chijeyr6cipvoy8rpttpehhvvu4&q=*&authuser=0&hl=en&gl=us,barceló tambor,06/06/2026,,junio
