reseña,calificación,tipo_lugar,fuente,nombre,fecha,grupo_de_viaje,mes
un lugar mágico y la playa genial lo único es la malo es la información errónea en la página del pago de la entrada llevar efectivo y tarjeta porque depende de ellos como cobran la entrada,5,parque nacional,https://search.google.com/local/reviews?placeid=chijhe3urnvxoy8r-zpqb_reqvy&q=*&authuser=0&hl=en&gl=us,parque nacional marino ballena,25/04/2026,,abril
visite la playa y estaba muy linda y con pocas personas por la época la entrada se puede pagar con tarjeta sale 678 usd,5,parque nacional,https://search.google.com/local/reviews?placeid=chijhe3urnvxoy8r-zpqb_reqvy&q=*&authuser=0&hl=en&gl=us,parque nacional marino ballena,23/04/2026,,abril
ha mejorado mucho quizá mi única observación es que sería conveniente un servicio de lockers o casilleros así uno guarda algunos artículos y se puede ir a bañar sin preocupaciones,4,parque nacional,https://search.google.com/local/reviews?placeid=chijhe3urnvxoy8r-zpqb_reqvy&q=*&authuser=0&hl=en&gl=us,parque nacional marino ballena,18/04/2026,,abril
lo mejor sus playas,3,parque nacional,https://search.google.com/local/reviews?placeid=chijhe3urnvxoy8r-zpqb_reqvy&q=*&authuser=0&hl=en&gl=us,parque nacional marino ballena,15/04/2026,,abril
muy bonito para visitar no se permite licor se puede llevar parlante costo aproximado 1000 iva por persona,5,parque nacional,https://search.google.com/local/reviews?placeid=chijhe3urnvxoy8r-zpqb_reqvy&q=*&authuser=0&hl=en&gl=us,parque nacional marino ballena,14/04/2026,,abril
maravilloso,5,parque nacional,https://search.google.com/local/reviews?placeid=chijhe3urnvxoy8r-zpqb_reqvy&q=*&authuser=0&hl=en&gl=us,parque nacional marino ballena,04/06/2026,,junio
precioso vayan con sombrilla o con buena gorra y bloqueador,5,parque nacional,https://search.google.com/local/reviews?placeid=chijhe3urnvxoy8r-zpqb_reqvy&q=*&authuser=0&hl=en&gl=us,parque nacional marino ballena,04/06/2026,,junio
a diferencia de otros parques nacionales que funcionan como centros turísticos masivos marino ballena conserva un aire de refugio el turismo que atrae es predominantemente familiar y tranquilo es el destino de quienes buscan la conexión con la naturaleza sin el ruido de las multitudes o la comercialización excesiva en cada esquina aquí el lujo es el espacio y el silencio puntos clave de la experiencia el tómbolo cola de ballena es la pieza central del parque una formación geológica única que requiere sincronía con la marea baja para ser caminada es un recorrido extenso que invita a la contemplación más que a la actividad frenética ausencia de ajetreo mientras que en manuel antonio es común caminar en senderos congestionados en marino ballena las distancias son tan vastas que es posible caminar kilómetros por la orilla sin sentir la presión de otros grupos de turistas entorno natural la vegetación llega hasta el borde de la arena ofreciendo sombra natural que las familias aprovechan para pasar el día sin necesidad de grandes infraestructuras ideal para familias que desean que sus hijos corran libres por la arena o para profesionales que buscan desconectarse del ruido académico y urbano,5,parque nacional,https://search.google.com/local/reviews?placeid=chijhe3urnvxoy8r-zpqb_reqvy&q=*&authuser=0&hl=en&gl=us,parque nacional marino ballena,04/01/2026,,enero
lugar hermoso para disfrutar el mar y la naturaleza,4,parque nacional,https://search.google.com/local/reviews?placeid=chijhe3urnvxoy8r-zpqb_reqvy&q=*&authuser=0&hl=en&gl=us,parque nacional marino ballena,31/03/2026,,marzo
demasiado bello muy limpio y excelente trato,5,parque nacional,https://search.google.com/local/reviews?placeid=chijhe3urnvxoy8r-zpqb_reqvy&q=*&authuser=0&hl=en&gl=us,parque nacional marino ballena,28/03/2026,,marzo
hermoso lugar caminamos por el sendero donde vimos monos y diferentes tipos de aves la playa muy tranquila y amplia,5,parque nacional,https://search.google.com/local/reviews?placeid=chijhe3urnvxoy8r-zpqb_reqvy&q=*&authuser=0&hl=en&gl=us,parque nacional marino ballena,22/03/2026,,marzo
ir por la manana 9 ya es muy tarde muy bueno para correr,5,parque nacional,https://search.google.com/local/reviews?placeid=chijhe3urnvxoy8r-zpqb_reqvy&q=*&authuser=0&hl=en&gl=us,parque nacional marino ballena,21/03/2026,,marzo
simplemente hermoso,5,parque nacional,https://search.google.com/local/reviews?placeid=chijhe3urnvxoy8r-zpqb_reqvy&q=*&authuser=0&hl=en&gl=us,parque nacional marino ballena,19/03/2026,,marzo
es precioso,5,parque nacional,https://search.google.com/local/reviews?placeid=chijhe3urnvxoy8r-zpqb_reqvy&q=*&authuser=0&hl=en&gl=us,parque nacional marino ballena,15/03/2026,,marzo
maravilla de lugar cuidenlo mucho se puede llegar en coche,5,parque nacional,https://search.google.com/local/reviews?placeid=chijhe3urnvxoy8r-zpqb_reqvy&q=*&authuser=0&hl=en&gl=us,parque nacional marino ballena,13/03/2026,,marzo
tenia años de no ir esta muy cuidado y sigue manteniendo esa esencia de maravilla,5,parque nacional,https://search.google.com/local/reviews?placeid=chijhe3urnvxoy8r-zpqb_reqvy&q=*&authuser=0&hl=en&gl=us,parque nacional marino ballena,13/03/2026,,marzo
es el lugar mas hermoso del mundo una playa espectacular,5,parque nacional,https://search.google.com/local/reviews?placeid=chijhe3urnvxoy8r-zpqb_reqvy&q=*&authuser=0&hl=en&gl=us,parque nacional marino ballena,03/12/2026,,diciembre
en nuestra experiencia al llegar a la playa por el sendero nos encontramos a un grupo de monos cara blanca comiendo en las palmeras de la costa despues en la cola de ballena del lado izquiero van a tener olas pero del lado derecho encuentran un mar muy tranquilo para refrescarse,5,parque nacional,https://search.google.com/local/reviews?placeid=chijhe3urnvxoy8r-zpqb_reqvy&q=*&authuser=0&hl=en&gl=us,parque nacional marino ballena,03/11/2026,,noviembre
el mejor parque nacional relacionado a un volcán que he visitado hasta el momento,5,parque nacional,https://search.google.com/local/reviews?placeid=chijq-6xnhz9dy8rkfbpxupjybo&q=*&authuser=0&hl=en&gl=us,parque nacional rincón de la vieja,06/05/2026,,mayo
un gran lugar lleno de vida y naturaleza,5,parque nacional,https://search.google.com/local/reviews?placeid=chijq-6xnhz9dy8rkfbpxupjybo&q=*&authuser=0&hl=en&gl=us,parque nacional rincón de la vieja,31/05/2026,,mayo
fue una experiencia única e increíble,5,parque nacional,https://search.google.com/local/reviews?placeid=chijq-6xnhz9dy8rkfbpxupjybo&q=*&authuser=0&hl=en&gl=us,parque nacional rincón de la vieja,28/05/2026,,mayo
cuenta con varios senderos para ver la actividad volcánica y darse un baño en las cataratas alrededor de 14 km de caminata,5,parque nacional,https://search.google.com/local/reviews?placeid=chijq-6xnhz9dy8rkfbpxupjybo&q=*&authuser=0&hl=en&gl=us,parque nacional rincón de la vieja,24/05/2026,,mayo
rincón de la vieja está bastante sobrevalorado para lo que cuesta si vienes de una zona volcánica o has visitado lugares como islandia el barro hirviendo y el azufre no impresionan tanto como uno esperaría por el precio de la entrada lo más interesante del parque es el contraste natural entre la sabana seca y el bosque húmedo esa transición sí tiene algo especial y muy propio de guanacaste lo peor es la sensación de pagar constantemente peajes improvisados en la carretera entrada elevada y una experiencia que siendo honestos no termina de justificar el costo,3,parque nacional,https://search.google.com/local/reviews?placeid=chijq-6xnhz9dy8rkfbpxupjybo&q=*&authuser=0&hl=en&gl=us,parque nacional rincón de la vieja,22/05/2026,,mayo
un parque precioso interesante toda la ruta miravalles tenorio rincón de la vieja estar en la parte norte de guanacaste rodeado de frescura y verdor,5,parque nacional,https://search.google.com/local/reviews?placeid=chijq-6xnhz9dy8rkfbpxupjybo&q=*&authuser=0&hl=en&gl=us,parque nacional rincón de la vieja,16/05/2026,,mayo
para ingresar se hace a través de propiedades privadas por lo cual se debe pagar una cuota de 800 colones por persona en el camino mucho antes de llegar a la zona de acceso a los senderos en ese trayecto se puede observar evidencias de las actividades del ice en los procesos de aprobechamiento de la energía geotermal de la zona una vez en el parque nacional hay una variedad de destinos a los que nos llevan los senderos en el recorrido más corto se puede observar la inpresionante actividad volcánica de la zona además del hermoso y abundante bosque que brinda sombra natural en la mayoría de los tramos junto con el constante sonido del agua de la quebrada y en otra parte del recorrido se aprecia lo que parecería ser un paisaje de pradera seca muy linteresante si se recorre el sendero corto yendo inicialmente hacia bajo en la primera desviación el recorrido brinda una experiencia la cual promete cada vez más ir superando la espectativa anterior en la cual se siente como si nos estuviéramos adentrando en las entrañas de un volcán cubierto por un leve capa de camuflaje que le disfraza de bosque exuberante indispensable llevar una botella con agua para el recorrido,5,parque nacional,https://search.google.com/local/reviews?placeid=chijq-6xnhz9dy8rkfbpxupjybo&q=*&authuser=0&hl=en&gl=us,parque nacional rincón de la vieja,05/07/2026,,julio
es muy bonito el parque y tiene buenos senderos para caminar,5,parque nacional,https://search.google.com/local/reviews?placeid=chijq-6xnhz9dy8rkfbpxupjybo&q=*&authuser=0&hl=en&gl=us,parque nacional rincón de la vieja,28/04/2026,,abril
parque nacional con varios sectores entradas para tour rápido se recomiendo el circulo de las pailas aprox 3km pero también hay acceso a dos cataratas de dificultad intermedia y avanzada se recomienda comprar las entradas antes ya que en el lugar no se venden se compran en linea en la página del sinac llevar buena hidratación dependiendo de la época puede ser muy caliente o muy ventoso,5,parque nacional,https://search.google.com/local/reviews?placeid=chijq-6xnhz9dy8rkfbpxupjybo&q=*&authuser=0&hl=en&gl=us,parque nacional rincón de la vieja,04/12/2026,,diciembre
hermoso e impecable estado,5,parque nacional,https://search.google.com/local/reviews?placeid=chijq-6xnhz9dy8rkfbpxupjybo&q=*&authuser=0&hl=en&gl=us,parque nacional rincón de la vieja,04/10/2026,,octubre
bonito fácil para caminatas cortas avistamiento de animales,5,parque nacional,https://search.google.com/local/reviews?placeid=chijq-6xnhz9dy8rkfbpxupjybo&q=*&authuser=0&hl=en&gl=us,parque nacional rincón de la vieja,04/09/2026,,septiembre
el parque merece la pena los senderos a las cataratas son impensbles si hace mucho calor es difícil llegar allí salvo que contrates un tour porque no hay bus puedes conseguir un uber de pero no te recogerán de vuelta la alternativa es un taxi local que te cobrará cuatro veces más,3,parque nacional,https://search.google.com/local/reviews?placeid=chijq-6xnhz9dy8rkfbpxupjybo&q=*&authuser=0&hl=en&gl=us,parque nacional rincón de la vieja,31/03/2026,,marzo
todos los ticos deberían conocer este lugar,5,parque nacional,https://search.google.com/local/reviews?placeid=chijq-6xnhz9dy8rkfbpxupjybo&q=*&authuser=0&hl=en&gl=us,parque nacional rincón de la vieja,26/03/2026,,marzo
maravilloso lugar,5,parque nacional,https://search.google.com/local/reviews?placeid=chijq-6xnhz9dy8rkfbpxupjybo&q=*&authuser=0&hl=en&gl=us,parque nacional rincón de la vieja,22/03/2026,,marzo
tiene senderos accesibles cerca hay otros sitios de interés como catarata la leona y pozas los coyotes,5,parque nacional,https://search.google.com/local/reviews?placeid=chijq-6xnhz9dy8rkfbpxupjybo&q=*&authuser=0&hl=en&gl=us,parque nacional rincón de la vieja,24/02/2026,,febrero
me encantó la catarata la cangreja y el sector pailas,5,parque nacional,https://search.google.com/local/reviews?placeid=chijq-6xnhz9dy8rkfbpxupjybo&q=*&authuser=0&hl=en&gl=us,parque nacional rincón de la vieja,22/02/2026,,febrero
el lugar es hermoso sin duda la historia de la casona es algo que siempre me cautivara la visitas de personas que se saben la historia lo vuelve todo agradable,5,parque nacional,https://search.google.com/local/reviews?placeid=chiju_khzf2xdy8rz9fp-5ruces&q=*&authuser=0&hl=en&gl=us,parque nacional santa rosa,30/05/2026,,mayo
precioso,5,parque nacional,https://search.google.com/local/reviews?placeid=chiju_khzf2xdy8rz9fp-5ruces&q=*&authuser=0&hl=en&gl=us,parque nacional santa rosa,28/05/2026,,mayo
el mirador es muy lindo,5,parque nacional,https://search.google.com/local/reviews?placeid=chiju_khzf2xdy8rz9fp-5ruces&q=*&authuser=0&hl=en&gl=us,parque nacional santa rosa,05/05/2026,,mayo
me encantó y se puede acceder fácilmente a la casona tomar en cuenta que la playa naranjo que queda ahí solo se puede entrar con un buen 4x4 ya que la calle está en bastante mal estado y no es para bañarse,5,parque nacional,https://search.google.com/local/reviews?placeid=chiju_khzf2xdy8rz9fp-5ruces&q=*&authuser=0&hl=en&gl=us,parque nacional santa rosa,04/07/2026,,julio
un lugar obligatorio para todo costarricense creo que se podrían agregar más objetos al museo pero la casona en sí es hermosa,4,parque nacional,https://search.google.com/local/reviews?placeid=chiju_khzf2xdy8rz9fp-5ruces&q=*&authuser=0&hl=en&gl=us,parque nacional santa rosa,04/02/2026,,febrero
hermoso lugar la casona es simplemente impresionante muy recomendado,5,parque nacional,https://search.google.com/local/reviews?placeid=chiju_khzf2xdy8rz9fp-5ruces&q=*&authuser=0&hl=en&gl=us,parque nacional santa rosa,28/03/2026,,marzo
visita 28 de febrero excelente playa naranjoalistamiento de un puma por el sector de los patos camino complicado 100 carro 4x4,5,parque nacional,https://search.google.com/local/reviews?placeid=chiju_khzf2xdy8rz9fp-5ruces&q=*&authuser=0&hl=en&gl=us,parque nacional santa rosa,03/02/2026,,febrero
el parque nacional santa rosa es simplemente espectacular es un lugar lleno de historia naturaleza y paisajes increíbles me encanta la combinación entre bosque seco tropical senderos bien señalizados y playas hermosas como playa naranjo además tiene un valor histórico enorme por la casona donde ocurrió la batalla de santa rosa lo que hace que la visita sea no solo natural sino también cultural los senderos están en muy buen estado hay buena señalización y el ambiente es súper tranquilo si tienes suerte puedes ver monos dantas felinos venados iguanas y una gran variedad de aves es perfecto para desconectarse caminar aprender y disfrutar del aire puro definitivamente es un destino que vale la pena visitar si estás en guanacaste una experiencia auténtica y llena de naturaleza costarricense,5,parque nacional,https://search.google.com/local/reviews?placeid=chiju_khzf2xdy8rz9fp-5ruces&q=*&authuser=0&hl=en&gl=us,parque nacional santa rosa,23/02/2026,,febrero
hermoso pudimos ver venados iguanas y monos muy cerca los senderos muy cuidadosaunque pequeños y la casona muy bonita el mirador es espectacular,5,parque nacional,https://search.google.com/local/reviews?placeid=chiju_khzf2xdy8rz9fp-5ruces&q=*&authuser=0&hl=en&gl=us,parque nacional santa rosa,27/01/2026,,enero
la ruta por la que nos mandó maps es una ruta alterna que no lleva al parque nacional santa rosa nos metió entre fincas y llega a un punto donde dice que se debe doblar a la izquierda y lo que hay es una cerca que esta cerrada pq es una finca privada cuando nos íbamos a devolver encontramos con un finquero que nos indicó que podiamos pasar un río el tempisque para poder llegar a la interamericana y no perder tanto el tiempo devolviéndonos por donde veníamos el río al final lo pasamos pero si es ancho y es recomendable para carros 4x4 a poca distancia realmente se encuentra la interamerica,1,parque nacional,https://search.google.com/local/reviews?placeid=chiju_khzf2xdy8rz9fp-5ruces&q=*&authuser=0&hl=en&gl=us,parque nacional santa rosa,24/01/2026,,enero
lugar increíble mas alla de la historia que existió ahi el bosque seco transmite una paz increíble,5,parque nacional,https://search.google.com/local/reviews?placeid=chiju_khzf2xdy8rz9fp-5ruces&q=*&authuser=0&hl=en&gl=us,parque nacional santa rosa,15/01/2026,,enero
es un lugar espectacular lconocer la historia de nuestro país en vivoy estar ahí no tiene precio,5,parque nacional,https://search.google.com/local/reviews?placeid=chiju_khzf2xdy8rz9fp-5ruces&q=*&authuser=0&hl=en&gl=us,parque nacional santa rosa,01/07/2026,,julio
nada que ver para ingresareso de sacar una reservacion ni que fuera muy visitado por multitud es por eso no queremos visitar los parques ya que se ponen en varas la casona ya no es la misma de cuando yo fui,1,parque nacional,https://search.google.com/local/reviews?placeid=chiju_khzf2xdy8rz9fp-5ruces&q=*&authuser=0&hl=en&gl=us,parque nacional santa rosa,29/12/2025,,diciembre
tiene senderos la casona la tienen bien cuidada hay zonas para merendar sin embargo no hay un lugar cerca para almorzar se pueden ver gran flora y fauna,5,parque nacional,https://search.google.com/local/reviews?placeid=chiju_khzf2xdy8rz9fp-5ruces&q=*&authuser=0&hl=en&gl=us,parque nacional santa rosa,12/10/2025,,octubre
un sitio de la historia costarricense un parque maravilloso senderos muy accesibles y bien demarcados una gran experiencia,5,parque nacional,https://search.google.com/local/reviews?placeid=chiju_khzf2xdy8rz9fp-5ruces&q=*&authuser=0&hl=en&gl=us,parque nacional santa rosa,11/02/2025,,febrero
llevar 4x4 para bajar a la playa si no la tienes mejor no ir no hay mucho que ver,2,parque nacional,https://search.google.com/local/reviews?placeid=chiju_khzf2xdy8rz9fp-5ruces&q=*&authuser=0&hl=en&gl=us,parque nacional santa rosa,10/10/2025,,octubre
historia y naturaleza,5,parque nacional,https://search.google.com/local/reviews?placeid=chiju_khzf2xdy8rz9fp-5ruces&q=*&authuser=0&hl=en&gl=us,parque nacional santa rosa,09/07/2025,,julio
llevaba muchas ganas de conocer este parque nacional y debo decir que es un lugar extraordinario pero las instalaciones se sienten algo abandonadas especialmente para ser uno de los sitios históricos más importantes del país lo que carece de infraestructura lo compensa con los paisajes y la belleza natural del lugar,4,parque nacional,https://search.google.com/local/reviews?placeid=chiju_khzf2xdy8rz9fp-5ruces&q=*&authuser=0&hl=en&gl=us,parque nacional santa rosa,09/07/2025,,julio
excelente lugar de fácil acceso y con mucha historia además con suerte puedes ver venaditos cola blanca,5,parque nacional,https://search.google.com/local/reviews?placeid=chiju_khzf2xdy8rz9fp-5ruces&q=*&authuser=0&hl=en&gl=us,parque nacional santa rosa,16/08/2025,,agosto
parque nacional santa rosa el pn santa rosa ubicado en guanacaste a unos 50 km de liberia declarado patrimonio de la humanidad conserva el último bosque tropical seco de mesoamérica dentro del parque encontrarás la casona escenario importante de la batalla de santa rosa del 20 de marzo de 1856 hoy después de ser quemada en 2001 por cazadores furtivos alberga un museo dentro del parque nacional y es parte del área de conservación guanacaste dentro de los atractivos del parque se encuentra playa naranjo ideal para los amantes del surf además aqui se encuentra la famosa peña bruja santa rosa cuenta con una extensión de 38674 hectáreas terrestres y 78 000 hectáreas de territorio marino el corredor biológico guanacasteco da cobijo a una amplia variedad de vida silvestre destacan entre los mamíferos los jaguares pumas dantas venados y pecaríes entre las aves pavones urracas tucanes y águilas pescadoras entre los reptiles destacan las tortugas carey baula verde y lora si quieres visitar este fascinante lugar es super sencillo la entrada al parque cuesta solo 1250 para nacionales y 17 para extranjeros esta abierto de miércoles a lunes de 800am a 330pm cerrado martes y es posible llegar en autobús liberiapeñas blancas,4,parque nacional,https://search.google.com/local/reviews?placeid=chiju_khzf2xdy8rz9fp-5ruces&q=*&authuser=0&hl=en&gl=us,parque nacional santa rosa,22/06/2025,,junio
excelente lugar para aprender parte de la historia de costa rica acceso barato para nacionales buena información en el lugar,5,parque nacional,https://search.google.com/local/reviews?placeid=chiju_khzf2xdy8rz9fp-5ruces&q=*&authuser=0&hl=en&gl=us,parque nacional santa rosa,23/02/2025,,febrero
muy bonito fue increíble ver venados,4,parque nacional,https://search.google.com/local/reviews?placeid=chiju_khzf2xdy8rz9fp-5ruces&q=*&authuser=0&hl=en&gl=us,parque nacional santa rosa,02/02/2025,,febrero
lugar histórico de costa rica y su cultura,5,parque nacional,https://search.google.com/local/reviews?placeid=chiju_khzf2xdy8rz9fp-5ruces&q=*&authuser=0&hl=en&gl=us,parque nacional santa rosa,02/01/2025,,enero
excelente lugar solo q me picaron los mosquitos jjj atención 10000010,5,parque nacional,https://search.google.com/local/reviews?placeid=chiju_khzf2xdy8rz9fp-5ruces&q=*&authuser=0&hl=en&gl=us,parque nacional santa rosa,28/01/2025,,enero
muy lindo lugar el acceso desde la carretera principal está en excelente estado asfaltado hasta el parqueo de la casona los trabajadores son muy amables el recorrido se hace fácilmente martes esta cerrado,4,parque nacional,https://search.google.com/local/reviews?placeid=chiju_khzf2xdy8rz9fp-5ruces&q=*&authuser=0&hl=en&gl=us,parque nacional santa rosa,14/01/2025,,enero
una experiencia agradablemuchas paz y sobre todo la historia que tiene mucho significado para nosotros los costarricense,4,parque nacional,https://search.google.com/local/reviews?placeid=chiju_khzf2xdy8rz9fp-5ruces&q=*&authuser=0&hl=en&gl=us,parque nacional santa rosa,01/10/2025,,octubre
todo tico debe darse la oportunidad de visitarlo,5,parque nacional,https://search.google.com/local/reviews?placeid=chiju_khzf2xdy8rz9fp-5ruces&q=*&authuser=0&hl=en&gl=us,parque nacional santa rosa,01/04/2025,,abril
hermoso el lugar muy cuidado vimos venados cola blanca,5,parque nacional,https://search.google.com/local/reviews?placeid=chiju_khzf2xdy8rz9fp-5ruces&q=*&authuser=0&hl=en&gl=us,parque nacional santa rosa,01/03/2025,,marzo
muy buen ambiente para meditar en nuestra herencia cultural y biológica,5,parque nacional,https://search.google.com/local/reviews?placeid=chiju_khzf2xdy8rz9fp-5ruces&q=*&authuser=0&hl=en&gl=us,parque nacional santa rosa,11/07/2024,,julio
un parque del tropico seco con cambios del ambiente natural a poca distancia de un punto a otro y con aves muy interesantes que se camuflan muy bien ejemplo el pajaro carpintero la lora nuca amarilla el mot mot asi también venados cola blanca monos cariblanca entre otros no hay centro de conveniencia por eso es bueno estar muy preparado con agua y otros,4,parque nacional,https://search.google.com/local/reviews?placeid=chiju_khzf2xdy8rz9fp-5ruces&q=*&authuser=0&hl=en&gl=us,parque nacional santa rosa,27/10/2024,,octubre
una experiencia inolvidable el guía muy atento y super explicativo la verdad al escuchar la historia uno puede imaginarse todo lo que sucedió de los lugares que tenemos que visitar al menos una vez en la vida,5,parque nacional,https://search.google.com/local/reviews?placeid=chiju_khzf2xdy8rz9fp-5ruces&q=*&authuser=0&hl=en&gl=us,parque nacional santa rosa,07/04/2024,,abril
bastante accesible para todas la personas desconocía que se debe reservar la entrada en línea pero el personal me ayudo a hacerlo y más que en esa zona no tenía acceso a internet,5,parque nacional,https://search.google.com/local/reviews?placeid=chiju_khzf2xdy8rz9fp-5ruces&q=*&authuser=0&hl=en&gl=us,parque nacional santa rosa,06/06/2024,,junio
sitio histórico y patrimonio de la unesco en costa rica donde se dieron batallas por la libertad de la provincia guanacastenorte como también batallas entre partidos politicos,3,parque nacional,https://search.google.com/local/reviews?placeid=chiju_khzf2xdy8rz9fp-5ruces&q=*&authuser=0&hl=en&gl=us,parque nacional santa rosa,23/04/2024,,abril
un area muy tranquila poca gente se ven bastantes iguanas y venados baños y duchas aseados los guardaparques muy amables,5,parque nacional,https://search.google.com/local/reviews?placeid=chiju_khzf2xdy8rz9fp-5ruces&q=*&authuser=0&hl=en&gl=us,parque nacional santa rosa,29/02/2024,,febrero
su historia y las instalaciones se puede caminar por el bosque y ver animales,4,parque nacional,https://search.google.com/local/reviews?placeid=chiju_khzf2xdy8rz9fp-5ruces&q=*&authuser=0&hl=en&gl=us,parque nacional santa rosa,26/02/2024,,febrero
mágico hermoso,5,parque nacional,https://search.google.com/local/reviews?placeid=chiju_khzf2xdy8rz9fp-5ruces&q=*&authuser=0&hl=en&gl=us,parque nacional santa rosa,02/06/2024,,junio
muy bonito el lugar y seguro recomendado una bonita experiencia,5,parque nacional,https://search.google.com/local/reviews?placeid=chiju_khzf2xdy8rz9fp-5ruces&q=*&authuser=0&hl=en&gl=us,parque nacional santa rosa,22/01/2024,,enero
hermoso lugar paz y tranquilidad se respira playa narranjo la mejor de las playas con esos 9km de extencion,5,parque nacional,https://search.google.com/local/reviews?placeid=chiju_khzf2xdy8rz9fp-5ruces&q=*&authuser=0&hl=en&gl=us,parque nacional santa rosa,01/12/2024,,diciembre
super limpiomuy atentos los guarda parques,5,parque nacional,https://search.google.com/local/reviews?placeid=chiju_khzf2xdy8rz9fp-5ruces&q=*&authuser=0&hl=en&gl=us,parque nacional santa rosa,01/02/2024,,febrero
